url,category,title,author,description,date,place,date_from,date_to
/lov01,HISTOIRE,LA DÉMOCRATIE EN SUISSE,Me R. LOVEY,"Congrès du Centre de Doc. Civique
Voici l’exposé si rare, et pourtant indispensable de la doctrine chrétienne de la société, de la vraie démocratie fondée sur la loi divine. Cette conférence nous rappelle l’idée qu’avaient nos ancêtres de la démocratie, en fondant la Confédération Helvétique",07.11.1981,Lausanne,07.11.1981,
/lov003,HISTOIRE,LA SUISSE : HISTOIRE DE LA CONFÉDÉRATION ET CIVISME,Me R. LOVEY,,23.10.1984,"Séminaire Inter. St Pie X, Écône",23.10.1984,
/lug3,HISTOIRE,L'ÉCHEC DES INDÉPENDANCES EN AFRIQUE,M. B. LUGAN,Avec l’auteur du Cercle d’Études Catho. “Christus Rex”.,23.03.1995,"Lauzon, Canada",23.03.1995,
/lug4,HISTOIRE,LE BILAN DE LA DÉCOLONISATION : VÉRITÉS ET LÉGENDES,M. B. LUGAN,Avec l’auteur du Cercle d’Études Catholiques “Christus Rex”.,23.03.1995,"Lauzon, Canada",23.03.1995,
/lug1,HISTOIRE,LE RWANDA,M. B. LUGAN,,28.11.1994,"Institut Uni. St-Grégoire le Grand, Lyon",28.11.1994,
/ly1,HISTOIRE,LA CHEVALERIE,M. LE ROY,,02.12.1996,"Institut Uni. St-Grégoire le Grand, Lyon",02.12.1996,
/MES1,HISTOIRE,RETOUR SUR L’AFFAIRE GALILÉE,M. P. MESSIER,Session d’étude.,27.06.1996,"Lauzon, Canada",27.06.1996,
/MLE6,HISTOIRE,"L’ÉGLISE JUDÉO-CHRÉTIENNE DE JÉRUSALEM, de 33 à 70",M. l’abbé Ph. MARCILLE,De nombreux indices attestent que la première communauté chrétienne fut formée par les Esséniens.,15.12.1999,Riddes,15.12.1999,
/MLE3,HISTOIRE,LE VRAI GALILÉE,M. l’abbe Ph. MARCILLE,.,05.10.1998,Grenoble,05.10.1998,
/MP1,HISTOIRE,LE MARÉCHAL PÉTAIN : son dévouement à la France,M. L.-D. GIRARD,,30.01.1981,Mantes-la-Jolie,30.01.1981,
/mp2,HISTOIRE,PÉTAIN FACE À L’HISTOIRE,M. le Géneral J. Le GROIGNEC,"Il a été appelé d’Espagne par le président Renaud car c’était la débandade et personne ne voulait gouverner. Sur 666 députés à l’Assemblée Nationale, 569 ont voté les pleins pouvoirs au Maréchal. Ils sont partis se réfugier en Angleterre, et en 1945 ils sont revenus, pour l’accuser et le condamner à mort pour “collaboration !”",20.05.2001,Saint- Alban,20.05.2001,
/OR1,HISTOIRE,"LA DESTRUCTION DE ST PIERRE DE LA MARTINIQUE PAR L’EXPLOSION DU MONT PELÉ, le jour de l’Ascension 1902",M. l’abbe J.C. ORTIZ,,01.03.1998,Riddes,01.03.1998,
/P2,HISTOIRE,"LES RACINES DE L’OCCIDENT : ATHÈNES, ROME ET JÉSUSALEM",M. H. PETIT,,27.10.1997,"Inst. St-Grégoire le Grand, Lyon",27.10.1997,
/pm4,HISTOIRE,LA CHRÉTIENTÉ : Les Corporatioons,R.P. PIERRE-MARIE O.P.,Présentation de la communauté de saint Dominique – Les Corporatioons – Le M.J.C.F.,16.06.1994,"Lauzon, Canada",16.06.1994,
/POR5,HISTOIRE,LA CRISE DE L’ESPRIT CHRÉTIEN ENTRE 1680 ET 1780,M. l’abbé N. PORTAIL,,12.01.1998,"Institut Uni. St-Grégoire le Grand, Lyon",12.01.1998,
/POR4,HISTOIRE,LA SAINT-BARTHÉLEMY ET LES GUERRES DE RELIGIONS,M. l’abbe N. PORTAIL,"A notre avis, c’est l’étude la plus sérieuse, la plus objective et la plus exhaustive, sur ce sujet si troublant.",17.02.1997,"Institut Uni. St-Grégoire le Grand, Lyon",17.02.1997,
/SA2,HISTOIRE,LA FONCTION DE L’INQUISITION (L’action des cathares),M. J. SAIGNOL,,1991,"Instit. St-Grégoire le Grand, Lyon",01.01.1991,31.12.1991
/SA4,HISTOIRE,LE BAPTÊME DE LA FRANCE,M. J. SAIGNOL,,14.11.1994,"Institut Uni. St-Grégoire le Grand, Lyon",14.11.1994,
/SA5,HISTOIRE,LE BAPTÊME DE LA FRANCE ET LES MISSIONS,M. J. SAIGNOL,,01.04.1995,"Instit. St-Grégoire le Grand, Lyon",01.04.1995,
/SA1,HISTOIRE,LE DÉCLIN DE LA MISSION,M. J. SAIGNOL,,18.01.1993,"Instit. St-Grégoire le Grand, Lyon",18.01.1993,
/SA7,HISTOIRE,LE MISSIONNAIRE ET LA LUTTE CONTRE L’ESCLAVAGE,M. J. SAIGNOL,,19.01.1998,"Instit. St-Grégoire le Grand, Lyon",19.01.1998,
/SA3,HISTOIRE,QU’EST-CE QU’UNE SOCIETE CHRÉTIENNE ?,M. J. SAIGNOL,,09.05.1994,"Instit. St-Grégoire le Grand, Lyon",09.05.1994,
/SAC1,HISTOIRE,"LA MONARCHIE FRANÇAISE. JÉSUS-CHRIST, ROI DE FRANCE",M. SACLIER de la BATIE,,16.06.1991,"Institut Uni. St-Grégoire le Grand, Lyon",16.06.1991,
/san1,HISTOIRE,LE RÔLE DE LA CHEVALERIE,M. A. SANFRATELLO,Conférences aux Chevaliers de Notre-Dame.,01.05.1999,Montalenghe,01.05.1999,
/SAU1,HISTOIRE,NORD CONTRE SUD : LES ORIGINES DE LA GUERRE DE SÉCESSION AUX ÉTATS-UNIS,M. B. SAUMADE,"D’après le livre de James M. Mc Pherson.
Conférence organisée par le MCCVS.",10.04.2008,Martigny,10.04.2008,
/vig2,HISTOIRE,LA RÉVOCATION DE L’ÉDIT DE NANTES,M. J. de VIGUERIE,,10.03.1997,"Institut St-Grégoire le Grand, Lyon",10.03.1997,
/vig1,HISTOIRE,SORCELLERIE ET RELIGION AUX XVIIÈME - XVIIIÈME SIÈCLES,M. J. de VIGUERIE,,03.04.1995,"Institut St-Grégoire le Grand, Lyon",03.04.1995,
/BIS1,ISLAM,UN PROBLÈME ACTUEL : L’SLAM FACE À LA CROIX,M. l’abbé L. BISELX,"Quel regard faut-il porter aujourd’hui sur le dialogue islamo-chrétien ?
Et qu’en pense l’Église catholique ?",21.03.2004,Sion,21.03.2004,
/cou07,ISLAM,LES ORIGINES DE L’ISLAM,M. E. COUVERT,,27.02.1992,"Institut Universitaire St Grégoire le Grand, Lyon",27.02.1992,
/LAR4,ISLAM,L’ISLAM,M. l’abbé LAROCHE,IIIème Congrès théologique de sì sì no no 1998 « L’Œcuménisme ».,21 - 24.04.1998,Albano-Rome,21.04.1998,24.04.1998
/lug2,ISLAM,L'ISLAM À LA CONQUÊTE DE L'AFRIQUE,M. B. LUGAN,,11.03.1996,"Institut Universitaire St-Grégoire le Grand, Lyon",11.03.1996,
/PJ1,ISLAM,"L’ISLAM, MENACE POUR L’OCCIDENT ?",M. l’abbé P. JEROME,"La naissance, le développement et les conquêtes islamiques.
Le sort des non-musulmans en pays d’Islam.",04.08.1991,Sierre,04.08.1991,
/cou06,JUDAÏSME,LA KABBALE JUIVE,M. E. COUVERT,,10.05.1993,"Institut Universitaire St Grégoire le Grand, Lyon",10.05.1993,
/PR2,JUDAÏSME,PEUT-ON ÊTRE JUIF ET CATHOLIQUE ?,M. l’abbé PRIEUR,,25.02.1994,"Institut Universitaire St-Grégoire le Grand, Lyon",25.02.1994,
/v04,JUDAÏSME,DU PEUPLE ÉLU AUX JUIFS PERFIDES,M. le prof. D. VIAIN,,11.12.1990,"Institut Universitaire St-Pie X, Paris",11.12.1990,
/v07,JUDAÏSME,DU PEUPLE ÉLU AUX JUIFS PERFIDES : LE MYSTÈRE D’ISRAËL,M. le prof. D. VIAIN,"Souvent nous nous demandons quelle est la raison d’être du peuple “élu” aujourd’hui. Quel est son rôle dans le plan de la Rédemption ? Cette conférence
apporte une réponse éclairée.",03.10.1992,Sion,03.10.1992,
/V11,JUDAÏSME,JUIFS ET CHRÉTIENS : 2000 ANS DE DIALOGUE,M. le prof. D. VIAIN,,13.01.1997,"Instit. St-Grégoire le Grand, Lyon",13.01.1997,
/V12,JUDAÏSME,LE JUDAÏSME,M. le prof. D. VIAIN,IIIème Congrès théologique de sì sì no no “Œcuménisme”.,21 - 24.04.1998,"Albano, Rome",21.04.1998,24.04.1998
/FRANQ1,LIBÉRALISME,"L’INFAILLIBILITÉ PONTIFICALE, LE SYLLABUS ET LA CRISE ACTUELLE DE L’ÉGLISE",Marquis de la FRANQUERIE,,1970 - 1980,Martigny,,31.12.1980
/GUE1,LIBÉRALISME,LIBÉRALISME ET ANTILIBÉRALISME - LE CHRIST-ROI,M. l’abbé R. GUEGUEN,,20.10 - 26.11 - 17.12.2004,Chapelle St Joseph,,
/jo10,LIBÉRALISME,L'ÉTAT CONTRE L'ÉGLISE SOUS SAINT PIE X,M. l’abbé B. de JORNA,"Étude actualisée de l’encyclique “Vehementer nos” (1).
Série de 4 conférences JO 10 à 13.",14.02.1994,"Institut Universitaire St Pie X, Paris",14.02.1994,
/jo12,LIBÉRALISME,"L'ÉTAT HORS D'ÉTAT - ÉTUDE ACTUALISÉE DE L'ENCYCLIQUE ""VEHEMENTER NOS"" ( 3)",M. l’abbé B. de JORNA,Sur la séparation de l’Église et de l’État.,28.03.1994,"Institut Uni. St Pie X, Paris",28.03.1994,
/jo06,LIBÉRALISME,"LA LETTRE SUR LE SILLON (1) LA DÉMOCRATIER DANS L'ÉGLISE, SELON MARC SANGNIER",M. l’abbé B. de JORNA,Analyse.,01.02.1993,"Institut Universitaire St Pie X, Paris",01.02.1993,
/jo07,LIBÉRALISME,"LA LETTRE SUR LE SILLON (2) : LA LIBERTÉ DANS L'ÉGLISE, SELON MARC SANGNIER",M. l’abbé B. de JORNA,Analyse.,01.03.1993,"Institut Universitaire St Pie X, Paris",01.03.1993,
/jo08,LIBÉRALISME,"LA LETTRE SUR LE SILLON (3) LA FRATERNITÉ DANS L'ÉGLISE, SELON MARC SANGNIER",M. l’abbé B. de JORNA,Analyse.,05.54.1993,"Institut Universitaire St Pie X, Paris",,
/jo09,LIBÉRALISME,"LA LETTRE SUR LE SILLON (4) L'ÉGLISE DANS LE DÉMOCRATIE, SELON MARC SANGNIER",M. l’abbé B. de JORNA,Analyse.,15.05.1993,"Institut Uni. St Pie X, Paris",15.05.1993,
/jo05,LIBÉRALISME,LE MODERNISME EST UNE HÉRÉSIE (5),M. l’abbé B. de JORNA,D’après l’Encyclique de Saint Pie X “Pascendi”.,10.03.1992,"Institut Universitaire St Pie X, Paris",10.03.1992,
/jo04,LIBÉRALISME,LE MODERNISME EST-IL UN MONSTRE ? (4),M. l’abbé B. de JORNA,D’après l’Encyclique de Saint Pie X “Pascendi”.,10.02.1992,"Institut Universitaire St Pie X, Paris",10.02.1992,
/jo03,LIBÉRALISME,LE MODERNISME N'A NI PÈRE NI MÈRE (3),M. l’abbé B. de JORNA,D’après l’Encyclique de St Pie X “Pascendi”.,13.01.1922,"Institut Universitaire St Pie X, Paris",13.01.1922,
/jo02,LIBÉRALISME,LE MODERNISME SANS SCIENCE NI CONSCIENCE (2),M. l’abbé B. de JORNA,D’après l’Encyclique de St Pie X “Pascendi”.,18.11.1991,"Institut Universitaire St Pie X, Paris",18.11.1991,
/jo01,LIBÉRALISME,"LE MODERNISME, MORT OU VIF ? (1)",M. l’abbé B. de JORNA,"Série de 5 conférences
D’après l’Encyclique de St Pie X “Pascendi”.",20.10.1991,"Institut Universitaire St Pie X, Paris",20.10.1991,
/jo14,LIBÉRALISME,SAINT PIE X ET LE REMÈDE À LA CRISE ACTUELLE,M. l’abbé B. de JORNA,"Homélie de la messe de Requiem, par M. l’abbé du Chalard.
Congrès théologique de sì sì no no, organisé à l’occasion du 10ème anniversaire de la mort de don Francesco Maria PUTTI, et du 20ème anniversaire de la fondation de sì sì no no.",08 - 10.12.1994,Albano-Rome,08.12.1994,10.12.1994
/las6,LIBÉRALISME,LA LIBERTÉ,M. A. de LASSUS,,06.03.1999,Caussade,06.03.1999,
/las07,LIBÉRALISME,LE LIBÉRALISME CATHOLIQUE,M. A. de LASSUS,,06.03.1999,"Le Treilhou, Caussade",06.03.1999,
/ME1,LIBÉRALISME,LA LIBERTÉ RELIGIEUSE,M. le prof. MERRY,"Cette conférence, à notre avis, la meilleure que nous ayons entendue à ce sujet. Elle fait une analyse harmonieuse des actes du Magistère, des écrits des Pères et du Concile.",16.10.1988,Genève,16.10.1988,
/MLE4,LIBÉRALISME,LE ROBOT LIBRE. Genèse de l’utopie libérale,M. l’abbe Ph. MARCILLE,,02.1999,Grenoble,01.02.1999,28.02.1999
/OSS1,LIBÉRALISME,LES DROITS DE L’HOMME DANS LE CADRE DU MAGISTÈRE ET DE LA PHILOSOPHIE.,Prof. J.-C. OSSADON VALDEZ,"4ème Congrès théologique de sì sì no no
“Bilan et perspectives, pour une vraie restauration de l’Église”.",03 - 05.08.2000,Rome,03.08.2000,05.08.2000
/P1,LIBÉRALISME,LA CRISE DE LA DÉMOCRATIE,M. H. PETIT,,25.11.1996,"Instit. St-Grégoire le Grand, Lyon",25.11.1996,
/pol05,LIBÉRALISME,LA LIBERTÉ DE LA PRESSE EST-ELLE UNE VALEUR ABSOLUE ?,M. C. POLIN,,09.10.1993,"Lauzon, Canada",09.10.1993,
/pol02,LIBÉRALISME,LA PHILOSOPHIE DES DROITS DE L’HOMME,M. C. POLIN,Techniquement médiocre.,07.10.1993,"Lauzon, Canada",07.10.1993,
/ru20,LIBÉRALISME,DIGNITÉ ET LIBERTÉ,M. l’abbé J.-M. RULLEAU,Session de théologie 1994.,12 - 16.04.1994,"Étoile du Matin, Bitsch",12.04.1994,16.04.1994
/tis22,LIBÉRALISME,SYMPOSIUM SUR LE MODERNISME POUR LE CENTENAIRE DE L’ENCYCLIQUE “PASCENDI”,Mgr B. TISSIER DE MALLERAIS,,07.11.2007,Paris,07.11.2007,
/ver2,LIBÉRALISME,ACTES DU MAGISTÈRE ET ENCYCLIQUES,M. l’abbé P. VERDET,,19.10.1998,"Institut St-Grégoire le Grand, Lyon",19.10.1998,
/ver3,LIBÉRALISME,"ENCYCLIQUE ""VEHEMENTER"" DE SAINT PIE X",M. l’abbé P. VERDET,,10.01.1999,"Institut St-Grégoire le Grand, Lyon",10.01.1999,
/ga12,MONSEIGNEUR LEFEBVRE,SIGNIFICATION ET POUVOIR DE LA CLOCHE CONSACRÉE – SON EXCELLENCE MONSEIGNEUR LEFEBVRE – HOMÉLIE DE MONSEIGNEUR LEFEBVRE,Mgr A. de GALARRETA,"Bénédiction de la cloche de l’église de Delémont, le 6.11.2005.
Homélie de Mgr Lefebvre, lors de la bénédiction de l’église de Délémont en 1990.",06.11.2005 - 06.10.1991,"Delémont, Écône",06.11.2005,06.10.1991
/le24,MONSEIGNEUR LEFEBVRE,60 ANS DE SACERDOCE : POURQUOI AVOIR PASSÉ 30 ANS EN AFRIQUE SI AUJOURD'HUI IL NE FAUT PLUS FAIRE DE CONVERSIONS ?,Mgr M. LEFEBVRE,"Divers témoignages de reconnaissance :
Abbé du Chalard.
Marc Dem .
Un élève des écoles de la Fraternité…",19.11.1989,Le Bourget,19.11.1989,
/le53,MONSEIGNEUR LEFEBVRE,ANNIVERSAIRE DE LA FONDATION D’ÉCÔNE ET SAINTETÉ SACERDOTALE – LES IMPOSSIBLES CONDITIONS DEMANDÉES PAR ROME,Mgr M. LEFEBVRE,,,"Séminaire International St Pie X, Écône",,
/le22,MONSEIGNEUR LEFEBVRE,"CONFÉRENCE DE PRESSE À L’OCCASION DES SACRES, 1988 - CONFÉRENCE DE PRESSE À L’OCCASION DU SACRE DE MONSEIGNEUR LICINIO RANGEL",Mgr m. LEFEBVRE – M. l'abbé SCHMIDBERGER,Cette conférence nous offre un moment historique exceptionnel !,15.06.1988,"Séminaire International St Pie X, Écône",15.06.1988,
/le29,MONSEIGNEUR LEFEBVRE,DERNIERE HOMÉLIE DE SON EXCELLENCE MONSEIGNEUR MARCEL LEFEBVRE ET PÉLERINAGE D’ACTION DE GRÂCE POUR LES SACRES,Mgr M. LEFEBVRE,Divers chants latins.,17.2.1991 - 19.11.1988,"Nice, Bulle",17.02.1991,19.11.1988
/le38,MONSEIGNEUR LEFEBVRE,EN CETTE CRISE DE L’ÉGLISE GARDONS LA FOI,Mgr M. LEFEBVRE,,15.01.1973,BREST,15.01.1973,
/le03,MONSEIGNEUR LEFEBVRE,ÉTÉ CHAUD 1976 : LA MESSE À LILLE,Mgr M. LEFEBVRE,"Homélie à l’occasion de la messe à Lille, le 29.8.1976 
1ère messe de l’abbé P. Groche, Besancon, le 5.9.1976
Sermon d’ouverture des facultés de l’Institut Universitaire Saint Pie X, Paris, 6.10.1984.",29.8.1976 - 5.9.1976 - 6.10.1984,"Lille, Besancon, Paris",29.08.1976,
/le06,MONSEIGNEUR LEFEBVRE,"EXHORTATIONS, CONSEILS...",Mgr M. LEFEBVRE,Session d’étude.,09 - 14.07.1990,Flavigny,09.07.1990,14.07.1990
/le17,MONSEIGNEUR LEFEBVRE,FÊTE-DIEU A ÉCÔNE : 2 HOMÉLIES,Mgr M. LEFEBVRE - Mgr A. de GALARRETA,"Les 25 ans de Sacerdoce de M. l’abbé Pierre Épiney, 29.5.1986.",29.05.1986 - 18.06.1992,"Séminaire Inter. St Pie X, Écône",29.05.1986,18.06.1992
/le10,MONSEIGNEUR LEFEBVRE,HOMÉLIES LORS DES 10 ET 20 ANS DE LA FRATERNITÉ SACERDOTALE ST PIE X,Mgr M. LEFEBVRE,"20ème anniversaire, 1.11.1990.
10ème anniversaire, 1.11.1980.
Ordination de diacres .
Toussaint.",01.11.1980 - 01.11.1990,Séminaire Inter. St Pie X,01.11.1980,01.11.1990
/le33,MONSEIGNEUR LEFEBVRE,ICI VOUS VOYEZ L’ÉGLISE VIVANTE (Ordinations 1980) – DIEU NOUS VEUT HUMBLES - C’EST POURQUOI IL NOUS A FAIT DÉPENDANTS DES SACREMENTS,Mgr M. LEFEBVRE,"Messe Chrismale.
Sous-Diaconat .
Pentecôte.",27.6.1980 - 04.04.1985,"Séminaire International St Pie X, Écône",27.06.1980,04.04.1985
/le28,MONSEIGNEUR LEFEBVRE,IL N’Y A QU’UNE RELIGION POUR SE SAUVER,Mgr M. LEFEBVRE,Les effets de la résurrection.,,,,
/le07,MONSEIGNEUR LEFEBVRE,ILS L’ONT DÉCOURONNE,Mgr M. LEFEBVRE,,27.09.1987,Annecy,27.09.1987,
/le13,MONSEIGNEUR LEFEBVRE,IN MEMORIAM DU RÉVÉREND PÈRE LUDOVIC-MARIE – “DIEU NOUS AIME D'UN AMOUR MISÉRICORDIEUX INFINI”,Mgr M. LEFEBVRE,"Homélie de Mgr M. Lefebvre.
Témoignage de M. le Curé Épiney.
Conférence inoubliable sur la miséricorde divine, du révérend père Barrielle.
Dies iræ, dies illa et divers autres chants liturgiques de Requiem.",04.03.1983,"Séminaire International St Pie X, Écône",04.03.1983,
/le31,MONSEIGNEUR LEFEBVRE,"JE DIS AUX ÉVÊQUES : «SOYEZ LES PASTEURS DE TOUTES LES BREBIS, ET AINSI JE N'AURAIS PAS BESOIN DE VENIR DANS VOS DIOCÈSES !» – POURQUOI L'HUILE D'OLIVE POUR LES SACREMENTS, ET QUE FAUT-IL POUR QU'ILS SOIENT VALIDES ? – ON VEUT DÉTRUIRE L'ÉGLISE, LA SOCIÉTÉ ET LES ÂMES",Mgr M. LEFEBVRE,"Homélie lors de la bénédiction de la chapelle de Colmar .
Homélie de pâques à Écône, 1980.
Ordinations, Écône, le 29.6.1979.",29.06.1979,"Séminaire International St Pie X, Écône",29.06.1979,
/le09,MONSEIGNEUR LEFEBVRE,JUBILÉ SACERDOTAL 1929 - 1979,Mgr M. LEFEBVRE,Homélie mémorable où Monseigneur Lefebvre appelle à la “croisade”.,23.09.1979,"Paris, Mutualité",23.09.1979,
/le32,MONSEIGNEUR LEFEBVRE,JUBILÉS ÉPISCOPAUX : 1977 - 1987 (30 ans et 40 ans d’épiscopat),Mgr M. LEFEBVRE,,10.09.1977 - 18.09.1987,Paris et Écône,10.09.1977,18.09.1987
/le47,MONSEIGNEUR LEFEBVRE,"L'“ÉTRANGE” QUESTIONNAIRE DU DIOCÈSE DE SION – LES ÉVÊQUES FRANÇAIS SE DISPUTENT AVEC ROME, CAR LEUR MANIÈRE DE COMBATTRE LA TRADITION DIVERGE",Mgr M. LEFEBVRE,Conférence aux amis et bienfaiteurs à Écône.,26.02.1987,"Séminaire Inter. St Pie X, Écône",26.02.1987,
/le14,MONSEIGNEUR LEFEBVRE,L'AMOUR DU SACRÉ-CŒUR ET LE RÔLE DU PRÊTRE – PLAIRE A DIEU PLUTÔT QU'AUX HOMMES,Mgr M. LEFEBVRE,"Ordinations Sacerdotales, diaconat et sous-diaconat.",07 - 08.04 - 29.06.1984,"Séminaire Inter. St Pie X, Écône",,
/le19,MONSEIGNEUR LEFEBVRE,L'IMMACULÉE CONCEPTION : UN CADEAU DU BON DIEU À L'HUMANITÉ,Mgr M. LEFEBVRE - M. l'abbé SCHMIDBERGER,2 homélies.,08.12.1987 - 08.12.1992,,08.12.1987,08.12.1992
/le16,MONSEIGNEUR LEFEBVRE,L’ÉGLISE APRÈS LE SYNODE,Mgr M. LEFEBVRE,,22.03.1986,Bruxelles,22.03.1986,
/le55,MONSEIGNEUR LEFEBVRE,LA DÉVOTION À LA TRÈS SAINTE VIERGE MARIE – AVIS POSITIF SUR SAN DAMIANO,Mgr M. LEFEBVRE,Conférence.,06.1989,Montalenghe,01.06.1989,30.06.1989
/le50,MONSEIGNEUR LEFEBVRE,LA PETITE HISTOIRE DE MA LONGUE HISTOIRE,Mgr M. LEFEBVRE,,,Saint Michel-en-Brenne,,
/le42,MONSEIGNEUR LEFEBVRE,LA RÉFORME LITURGIQUE – ORDRES MINEURS ET SOUS-DIACONA T,Mgr M. LEFEBVRE,,23 - 24.06.1981,"Séminaire Inter. St Pie X, Écône",23.06.1981,24.06.1981
/le11,MONSEIGNEUR LEFEBVRE,"LA RÉPONSE DE ROME AUX OBJECTIONS SUR LA LIBERTÉ RELIGIEUSE, DE LÀ LA F.S.S.P.X, – LE PANTHÉON DES RELIGIONS – ANNONCE DES SACRES – VIENS ET SUIS-MOI",Mgr M. LEFEBVRE,"Ordinations sacerdotales
Sous-Diaconat, Ecône.",29.6.1987 - 30.5.1987,"Séminaire International St Pie X, Écône",29.06.1987,30.05.1987
/le48,MONSEIGNEUR LEFEBVRE,LA TÂCHE DE L’ÉGLISE EST LA PROPAGATION DE LA FOI – COMMENT POUVONS-NOUS PRIER AVEC LES JUIFS QUI NE RECONNAISSENT PAS JÉSUS ? – NOUS NE POUVONS PAS METTRE LA VÉRITÉ ET L’ERREUR SUR LE MÊME PLAN,Mgr M. LEFEBVRE,"3 homélies
Messe Chrismale, Pâques, Pentecôte.",27 - 30.03.1986,"Séminaire International St Pie X, Écône",27.03.1986,30.03.1986
/le46,MONSEIGNEUR LEFEBVRE,"LA TRADITION EN ARGENTINE, GUADELOUPE ET MARTINIQUE - COMMENTAIRE DU DERNIER SYNODE ET SES CONSÉQUENCES DANS LA VIE DE L’ÉGLISE",Mgr M. LEFEBVRE,"Aux amis et bienfaiteurs, à Écône.",16.01.1986,"Séminaire Inter. St Pie X, Écône",16.01.1986,
/le04,MONSEIGNEUR LEFEBVRE,"LA TRADITION, REMPART DE NOTRE FOI",Mgr M. LEFEBVRE,,1982,Montréal,01.01.1982,31.12.1982
/le39,MONSEIGNEUR LEFEBVRE,"LA VIERGE MARIE, REMPART DE LA CHRETIENTÉ",Mgr M. LEFEBVRE,"Cantiques traditionnels interprétés par les séminaristes d’Écône
Adoro Te devote.
Ave Maria.
Tantum Ergo
Kyriale de Angelis
Credo
O filii et filiæ
Præclara.
Orgue.
Lauda Sion.
Salve Regina.
Christus Vincit.
Tu es Petrus.
Sancte Pie decime.",14.05.1983,Munich,14.05.1983,
/le01,MONSEIGNEUR LEFEBVRE,LE LIBÉRALISME - LE SIDA SPIRITUEL,Mgr M. LEFEBVRE,,27.11.1988 - 29.03.1987,Sierre - Sion,27.11.1988,29.03.1987
/le43,MONSEIGNEUR LEFEBVRE,LE MYSTÈRE DE LA CROIX : SCANDALE POUR LE MONDE – LE PRÊTRE A QUELQUE CHOSE D’ÉTERNITÉ,Mgr M. LEFEBVRE,"Ordinations à Écône, le 29.6.1982, et à Montalenghe.",29.6.1982,Écône et Montalenghe,29.06.1982,
/le15,MONSEIGNEUR LEFEBVRE,LE MYSTÈRE DE LA RÉDEMPTION ET LE PÉCHÉ ORIGINEL – LE CHARISMATISME,Mgr M. LEFEBVRE,"Pâques , Pentecôte, Ordinations sacerdotales 1985.",29.06.1985,"Séminaire International St Pie X, Écône",29.06.1985,
/le41,MONSEIGNEUR LEFEBVRE,LE VOYAGE AU MEXIQUE RACONTÉ PAR MONSEIGNEUR MARCEL LEFEBVRE,Mgr M. LEFEBVRE,,09 - 12.02.1981,"Séminaire Inter. St Pie X, Écône",09.02.1981,12.02.1981
/le08,MONSEIGNEUR LEFEBVRE,LETTRE OUVERTE AUX CATHOLIQUES PERPLEXES,Mgr M. LEFEBVRE,Enregistrement du livre par un lecteur.,,,,
/le45,MONSEIGNEUR LEFEBVRE,NE CRAIGNONS PAS DE TÉMOIGNER NOTRE FOI - SOYONS HUMBLES ET VRAIMENT CATHOLIQUES - 5 HOMÉLIES : PAR LES 12 FRUITS DU SAINT-ESPRIT - LA PENSÉE DE SAINT THOMAS SUR LES SACREMENTS - L’ÂME HUMAINE DE JÉSUS,Mgr M. LEFEBVRE,"Pentecôte, 18 - 19.05.1986.
Jeudi-Saint et Pâques 1984.",18 - 19.05.1986,"Séminaire Inter. St Pie X, Écône",18.05.1986,19.05.1986
/le37,MONSEIGNEUR LEFEBVRE,"NI SCHISMATIQUES, NI HÉRÉTIQUES, MAIS CATHOLIQUES ! – LE RENONCEMENT",S. E. Mgr LEFEBVRE,"– Ordinations Sacerdotales, le 29.6.1983
– Noël 1983 “Le renoncement”",29.06.1983 - 25.12.1983,"Séminaire Inter. St Pie X, Écône",29.06.1983,25.12.1983
/le36,MONSEIGNEUR LEFEBVRE,NOUS NE VOULONS PAS DEVENIR PROTESTANTS – NOTRE FOI DOIT ÊTRE IMMUABLE COMME DIEU-MÊME,S. E. Mgr LEFEBVRE,30 ans d’épiscopat : Notre foi doit être immuable comme Dieu-même,21.03.1982 - 18.09.1977,Martigny - Écône,21.03.1982,18.09.1977
/le35,MONSEIGNEUR LEFEBVRE,ORDINATIONS 1976 - IMMACULÉE CONCEPTION 1976,Mgr M. LEFEBVRE,,29.06. - 24.10 - 08.12.1976,"Séminaire Inter. St Pie X, Écône",,
/le18,MONSEIGNEUR LEFEBVRE,PELERINAGE A FATIMA (Messe chantée du Cœur Immaculé de Marie et homélie),Mgr M. LEFEBVRE,,22.08.1987,Fatima,22.08.1987,
/le27,MONSEIGNEUR LEFEBVRE,PENTECÔTE 1985,Mgr M. LEFEBVRE,LE CHARISMATISME – SOUS-DIACONAT,30.05.1985,"Séminaire International St Pie X, Écône",30.05.1985,
/le49,MONSEIGNEUR LEFEBVRE,POUR L’AMOUR DE L’ÉGLISE : LE CHRIST-ROI,Mgr M. LEFEBVRE,Les plus belles allocutions sur la Royauté Sociale de Notre-Seigneur Jésus-Christ.,,"Séminaire Inter. St Pie X, Écône",,
/le26,MONSEIGNEUR LEFEBVRE,POURQUOI CONSTRUIRE DES ÉGLISES AUJOURD'HUI ?,Mgr M. LEFEBVRE – Mgr TISSIER de MALLERAIS,"Bénédiction de la nouvelle église de Delémont
Deux sermons.",1990,Delémont,01.01.1990,31.12.1990
/le54,MONSEIGNEUR LEFEBVRE,POURQUOI J’AI REFUSÉ LES ACCORDS AVEC ROME,Mgr M. LEFEBVRE,,11.06.1988,Flavigny,11.06.1988,
/le40,MONSEIGNEUR LEFEBVRE,POURQUOI SOMMES-NOUS PERSÉCUTÉS ? – SAINT JEAN BAPTISTE,Mgr M. LEFEBVRE - M. l'abbé LORANS,Rassemblement à Martigny.,08 - 09.12.1984,Martigny,08.12.1984,09.12.1984
/le44,MONSEIGNEUR LEFEBVRE,PRIÈRE ET PÉNITENCE POUR L’ÉGLISE. “NOUS NE POUVONS PAS PACTISER AVEC LES ENNEMIS DE NOTRE-SEIGNEUR”,Mgr M. LEFEBVRE,,25.08.1985,Flüeli,25.08.1985,
/le34,MONSEIGNEUR LEFEBVRE,RETRAITE SACERDOTALE,Mgr M. LEFEBVRE,,04.09.1987,"Séminaire International St Pie X, Écône",04.09.1987,
/le30,MONSEIGNEUR LEFEBVRE,SA DERNIÈRE CONFÉRENCE,Mgr M. LEFEBVRE,"Lors de la soirée des Amis et bienfaiteurs à Écône
C’est émouvant de l’entendre plaisanter sur ses problème de santé, alors que dès le lendemain il sera conduit à l’hôpital d’où il ne reviendra pas. Il est décédé 18 jours plus tard.",07.03.1991,"Séminaire International St Pie X, Écône",07.03.1991,
/le23,MONSEIGNEUR LEFEBVRE,SACRES ET ORDINATIONS SACERDOTALES,Mgr M. LEFEBVRE,,29 - 30.06.1988,"Séminaire Inter. St Pie X, Écône",29.06.1988,30.06.1988
/le12,MONSEIGNEUR LEFEBVRE,SEULE LA VIERGE MARIE A CONSERVÉ LA FOI LE VENDREDI SAINT – N'ABANDONNONS PAS L'ÉGLISE ! – HOMÉLIE DE PENTECÔTE,Mgr M. LEFEBVRE,Ordinations sacerdotales et diaconat.,30.05 – 29.06.1982,"Séminaire Inter. St Pie X, Écône",30.05.1982,29.06.1982
/le20,MONSEIGNEUR LEFEBVRE,"UBI MARIA, IBI ECCLESIA",Mgr M. LEFEBVRE,2 homélies : Pentecôte et Christ-Roi 1988.,14.05 - 25.10.1988,"Séminaire Inter. St Pie X, Écône",14.05.1988,25.10.1988
/le21,MONSEIGNEUR LEFEBVRE,UN SEUL DIEU TU ADORERAS – PENTECÔTE,Mgr M. LEFEBVRE,"2 homélies
Ordinations.
Pentecôte.",27.06.1986,"Séminaire International St Pie X, Écône",27.06.1986,
/s09,MONSEIGNEUR LEFEBVRE,MESSE DE REQUIEM DE SON EXCELLENCE MONSEIGNEUR MARCEL LEFEBVRE,M. l’abbé F. SCHMIDBERGER,"Oraison funèbre prononcée par M. l’abbé Franz Schmidberger, Supérieur de la Fraternité Sacerdotale St Pie X.",02.04.1991,"Séminaire Inter. St Pie X, Écône",02.04.1991,
/tis15,MONSEIGNEUR LEFEBVRE,LA VOCATION DE SON EXCELLENCE MONSEIGNEUR MARCEL LEFEBVRE : COMMENT IL A RESSENTI L’APPEL AU SACERDOCE,Mgr B. TISSIER DE MALLERAIS,Récollection des dames.,26.11.2001,Riddes,26.11.2001,
/tis14,MONSEIGNEUR LEFEBVRE,LA VOLONTÉ DE DIEU – MONSEIGNEUR LEFEBVRE : DU NOVICIAT DES PÈRES DU SAINT-ESPRIT À LA DIRECTION DU SÉMINAIRE DE LIBREVILLE – FIDÉLITÉ À LA VOLONTÉ DE DIEU : L’EXEMPLE DE LA FAMILLE TRAPP,Mgr B. TISSIER DE MALLERAIS,"Récollection des hommes, Riddes.",25.11.2001,Riddes,25.11.2001,
/tr69,MONSEIGNEUR LEFEBVRE,LE CENTIÈME ANNIVERSAIRE DE LA NAISSANCE DE MONSEIGNEUR LEFEBVRE,M. l’abbé P. TROADEC,Retraite de vie Chrétienne. Conférence no 4.,23 - 29.07.2005,Flavigny,23.07.2005,29.07.2005
/avr0,MUSIQUE,HYMNE MARIAL LIBANAIS,Rév. père M. AVRIL,"Viens du Liban, ô Bien-Aimée, nous te chantons avec ferveur ! …
Donne au Liban, ô Bien-Aimée, de rayonner Notre-Seigneur ! …
Paroles et musique du Réérend père Maurice Avril.
Reproduction commerciale non autorisée.",,,,
/BEU2,MUSIQUE,"HYMNE À LA JOIE, L’HYMNE EUROPÉEN",Mlle BEUTTER,,15.03.1997,"Institut Universitaire St-Grégoire le Grand, Lyon",15.03.1997,
/BEU3,MUSIQUE,LA MUSIQUE ET LE SACRÉ-CŒUR,Mlle BEUTTER,,12.04.1997,"Institut Universitaire St-Grégoire le Grand, Lyon",12.04.1997,
/BEU1,MUSIQUE,MUSIQUE SACRÉE ET MUSIQUE PROFANE,Mlle BEUTTER,,15.02.1993,"Institut Universitaire St-Grégoire le Grand, Lyon",15.02.1993,
/cha15a,MUSIQUE,“LAUDATE DOMINUM”,Le cœur de Russie Blanche,"Chants religieux, liturgiques et polyphoniques.",08.12.1992,Zaitzkofen,08.12.1992,
