url,category,title,author,description,date,place,date_from,date_to
/e25,POUR LES ENFANTS,NOTRE-DAME DE GUADALUPE - LE JONGLEUR DE NOTRE-DAME - PLUME D’ARGENT - L’HOMME QUI CHERCHAIT LE DIABLE,Par un conteur,Enfants.,,,,
/E10,POUR LES ENFANTS,NOTRE-DAME DE LA SALETTE,Par une conteuse,L’apparition du 19 septembre 1846 racontée aux enfants.,,,,
/E11,POUR LES ENFANTS,NOTRE-DAME DE LOURDES - STE GERTRUDE – LE SACRIFICE,M. l'abbé M.,"3 sermons aux enfants du catéchisme
Notre-Dame de Lourdes – Sainte Gertrude – Le Sacrifice.
Qu’est-ce que le sacrifice ?
Le sacrifice du petit Guy de Fontgalland.",11.02,Sion,,
/E18,POUR LES ENFANTS,SAINT ANTOINE DE PADOUE - SUR LES SENTIERS DES BOROROS - LA ROME CHRÉTIENNE - SAINT PIERRE DE ROME,Par un conteur,Enfants,,,,
/E19,POUR LES ENFANTS,SAINT BENOÎT - SAINTE THÉRÈSE DE L’ENFANT JÉSUS,Par un conteur,Enfants.,,,,
/E12,POUR LES ENFANTS,SAINT DOMINIQUE SAVIO,Par une conteuse,"La très belle vie de cet élève de saintt Jean Bosco. Mort à 15 ans, il est le modèle et le protecteur de la jeunesse.",,,,
/E16,POUR LES ENFANTS,SAINT DOMINIQUE SAVIO - MICHEL MAGON,Par un conteur,Enfants,,,,
/e22-1,POUR LES ENFANTS,SAINT FRANÇOIS D’ASSISE,Par un conteur,Enfants,,,,
/E20,POUR LES ENFANTS,SAINT FRANCOIS XAVIER - SAINT FRANCOIS DE SALES,Par un conteur,Enfants,,,,
/e23,POUR LES ENFANTS,SAINT JEAN BOSCO,Par un conteur,Enfants,,,,
/e24,POUR LES ENFANTS,SAINT PAUL DE LA CROIX - SAINT MAXIMILIEN KOLBE - SAINT MARTIN DE PORRES,Par un conteur,Enfants,,,,
/E17,POUR LES ENFANTS,SAINTE CATHERINE DE SIENNE - SAINT GABRIEL DE L’ADDOLORATA,Par un conteur,Enfants,,,,
/e18b,POUR LES ENFANTS,SAINTE CATHERINE LABOURÉ – LE LOUP DE GUBBIO,Par un conteur,Deux récits captivants.,,,,
/e22-2,POUR LES ENFANTS,SAINTE CLAIRE D’ASSISE,Par un conteur,Enfants,,,,
/e09,POUR LES ENFANTS,SAINTE JEANNE D’ARC,Par une conteuse,"Née à Domrémy, le 6 janvier 1412, Jeanne est appelée à une grande mission. Devenue cheffe de guerre, elle libère la France des Anglais et fait couronner Charles VII. Elle fut brûlée vive le 30 mai 1431 à Rouen.",06.01,,,
/e06,POUR LES ENFANTS,SERMONS : LE TRÉSOR CACHÉ - LE SAINT SCRIFICE DE LA MESSE RACONTÉ AUX ENFANTS,M. l'abbé M.,Enfants : 6 Sermons aux enfants du catéchisme.,,Sion,,
/e02,POUR LES ENFANTS,VIE DE SAINTS (2),M. l'abbé M.,"Enfants : 4 Sermons aux enfants du catéchisme
Saint Faustin et saint Jovite, 15 février.
Saint Jean de Matha, 8 février.
Saint Pascal Baylon, 17 mai.
Saint Athanas, 2 mai.",15.02,Sion,,
/e05,POUR LES ENFANTS,VIE DE SAINTS (5),M. l'abbé M.,"Enfants : Sermons aux enfants du catéchisme
Saint Nicolas de Myre, 6 décembre.
La Sainte Vierge au Temple, 21 novembre.
Annonciation, 25 mars.
La valeur du Saint Sacrifice de la Messe.
Le mois de Marie.
La Passion de Jésus.",06.12,Sion,,
/e01,POUR LES ENFANTS,VIE DE SAINTS (6),M. l'abbé M.,"Enfants : 6 Sermons aux enfants du catéchisme
Saint Isidore et la Sainte Messe, 13 février.
Notre-Dame de Guadalupe, 12 décembre.
Sainte Marguerite-Marie à La Coque, 17 octobre.
Saint Mathieu, 21 août.
Saint Léon le Grande, 11 avril.
Saint Josaphat, 14 novembre.",13.02,Sion,,
/e03,POUR LES ENFANTS,VIE DES SAINTS (3),M. l'abbé M.,"Enfants : Sermons aux enfants du catéchisme
Sainte Lucie, 13 décembre.
Sainte Cécile, 22 novembre.
Saint Albert le Grand, 15 novembre.
Saint François Caracciolo, 4 juin.
Saint André, Apôtre, 30 novembre.
Les saintes âmes du purgatoire.",13.12,Sion,,
/e04,POUR LES ENFANTS,VIES DE SAINTS (4),M. l'abbé M.,"Sermons aux enfants du catéchisme
Saint Pie X, 3 septembre.
Saint Stanislas, 14 mai.
Saint André Corsini, 4 février.
Saint Jean Népomucène, 16 mai.
Saint Romuald, 7 février.
Saint Jean Bosco, 31 janvier.",03.09,Sion,,
/e07,POUR LES ENFANTS,VIES DE SAINTS (7),M. l'abbé M.,"Enfants : 7 Sermons aux enfants du catéchisme
Saint Paul de la Croix, 28 avril.
Saint Blaise, 3 février.
Saint Grégoire le Grand, 25 mai.
Sainte Catherine d’Alexandrie.
Le prêtre, le roi Maure et la Messe.
Le Mystère de l’Incarnation et la Messe.
La Communion.",28.04,Sion,,
/e28,POUR LES ENFANTS,VIES DES SAINTE ET INSTRUCTIONS (9),M. l'abbé M.,"Sermons aux enfants du catéchisme
Saint Paul : La conversion, 25 janvier.
Saint Tite, 6 février.
Saint Marc, 25 mars.
L’Épiphanie, 6 janvier.
La Dédicace de Saint-Pierre et Saint-Paul, 18 novembre.
L’Enfer : Le temps de la Passion.
Chants
Sainte Vierge ô ma Mère.
Sur la patène.",25.01,Sion,,
/e30,POUR LES ENFANTS,VIES DES SAINTES ET INSTRUCTIONS (11),Abbé M.,"Sermons aux enfants du catéchisme
Jean de Saint-Facond et la messe.
Charlemagne, le Duc de Saxe et la messe.
Jean d’Alverne et la messe.
Quel est le plus grand miracle?
La valeur du Sacrifice parfait.
L’Annonciation (5 chants d’enfants).",,Sion,,
/E21,POUR LES ENFANTS,SAINT FRANÇOIS D’ASSISE - SAINTE CLAIRE D’ASSISE,Par un conteur,Enfants,,,,
/BERN2,PSYCHOLOGIE,MACHIAVEL PÉDAGOGUE OU LE MINISTÈRE DE LA RÉFORME PSYCHOLOGIQUE,M. P. BERNARDIN,,23.04.1997,Bruxelles,23.04.1997,
/lo43,PSYCHOLOGIE,FOI ET PSYCHANALYSE (Freud et le Diable),M. l’abbé A. LORANS,«Questions actuelles de psychologie».,1994 - 1995,"Institut Uni. St Pie X, Paris",,31.12.1995
/lo03,PSYCHOLOGIE,LA DÉPRESSION (1),M. l’abbé A. LORANS,Les déprimés ont-ils besoin de comprimés ?,13.03.1989,"Institut Uni. St Pie X, Paris",13.03.1989,
/LO13,PSYCHOLOGIE,LA DÉPRESSION (2),M. l’abbé A. LORANS,,02.10.1993,Sion,02.10.1993,
/lo02,PSYCHOLOGIE,LA PSYCHANALYSE,M. l’abbé A. LORANS,Une conférence spécialement conseillée aux étudiants des écoles supérieures et à toute personne chargée d’éducation.,21.05.1985,Sion,21.05.1985,
/lo29,PSYCHOLOGIE,LA PSYCHOLOGIE DE LA LIBÉRATION,M. l’abbé A. LORANS,Session d’étude,09 - 14.07.1990,Flavigny,09.07.1990,14.07.1990
/lo05,PSYCHOLOGIE,LA SUBVERSION PSYCHANALYTIQUE,M. l’abbé A. LORANS,Intervention au colloque de l’Institut Universitaire St Pie X.,1989,"Institut Uni. St Pie X, Paris",01.01.1989,31.12.1989
/lo36,PSYCHOLOGIE,LES ANTI-DÉPRESSEURS OU LE BONHEUR SUR ORDONNANCE,M. l’abbé A. LORANS,Avec l’autorisation du Cercle d’Études Catholique “Christus Rex” Lauzon.,26.01.1995,"Lauzon, Canada",26.01.1995,
/lo44,PSYCHOLOGIE,LES NOUVEAUX TRAITEMENTS DE LA DÉPRESSION,M. l’abbé A. LORANS,,07.11.1994,"Institut Uni. St Pie X, Paris",07.11.1994,
/lo46,PSYCHOLOGIE,PSYCHOLOGIE ET DIRECTION SPIRITUELLE,M. l’abbe A. LORANS,,15.05.1995,"Institut Uni. St Pie X, Paris",15.05.1995,
/lo01,PSYCHOLOGIE,PSYCHOPATHOLOGIE ET EXORCISME (Les démons et les déments),M. l’abbé A. LORANS,,06.02.1989,"Institut Uni. St Pie X, Paris",06.02.1989,
/lo45,PSYCHOLOGIE,RUDOLF ALLERS OU L’ANTI-FREUD : UN PSYCHAITRE PHILOSOPHE,M. l’abbé A. LORANS,,09.01.1995,"Institut Uni. St Pie X, Paris",09.01.1995,
/mi2,PSYCHOLOGIE,LA COMMUNICATION,M. le prof. L. MILLET,Questions de psychologie,14.01.1991,"Institut Uni. St Pie X, Paris",14.01.1991,
/MI1,PSYCHOLOGIE,LA PSYCHOLOGIE EN ENTREPRISE,M. le prof. L. MILLET,,12.11.1990,"Institut Uni. St Pie X, Paris",12.11.1990,
/avr07,RETRAITES SPIRITUELLES,RÉCOLLECTION DE NOËL : “ET EN LUI ÉTAIT LA VIE”,Rév. père M. AVRIL,Méditations sur le prologue de Saint Jean.,2015,Salerans,01.01.2015,31.12.2015
/avr11,RETRAITES SPIRITUELLES,RETRAITE : LES INSONDABLES RICHESSES DU VERBE INCARNÉ,Rév. père M. AVRIL,"Besoin de solitude - Qui est Celui-ci ?
La Sainte Messe .
Une seule foi.
Incorporés au Christ total.
La vie d’identification à Jésus-Christ.
Jusqu’au bout de Jésus.",5 - 7.09.2017,Salerans,05.09.2017,07.09.2017
/avr02,RETRAITES SPIRITUELLES,RETRAITE : LES INSONDABLES RICHESSES EUCHARISTIQUES DE JÉSUS ET DE MARIE,Rév. père M. AVRIL,"Toutes les générations me proclameront bienheureuse.
Contemplation de Notre-Dame de la Sainte Messe.
Contemplation du Père et du Fils.
Spiritualité mariale de la Sainte Messe.
La Sainte Messe en ce Vendredi Saint.
Jésus, prêtre et hostie.
En Lui était la vie.
La dernière messe.
La vie d’union avec Marie.
Aimer Jésus avec le Cœur de Marie.",06 - 10.09.2016,Salerans,06.09.2016,10.09.2016
/avr10,RETRAITES SPIRITUELLES,RETRAITE DE LA SEMAINE SAINTE,Rév. père M. AVRIL,"La foi.
L’action de grâce.
Le péché.
La Sainte Messe.
Notre incorporation à Jésus.
Marie, Reine du Cénacle.
Heure Sainte devant le Reposoir.
L’Océan de douleur.
Le Chemin de la Croix.
Contemplation de Marie.",2017,Salerans,01.01.2017,31.12.2017
/avr01,RETRAITES SPIRITUELLES,RETRAITE EUCHARISTIQUE,Rév. père M. AVRIL,,09.2015,Salerans,01.09.2015,30.09.2015
/avr06,RETRAITES SPIRITUELLES,RETRAITE PASCALE,Rév. père M. AVRIL,"Mercredi Saint : Ouverture, Vexilla Regis, Rendre Gloira à Dieu.
L’Adoration de Dieu.
Hors de l’Église point de salut.
Jeudi Saint : La Sainte Cène, le péché.
Vendredi Saint : La mort au péché.
L’Église Une, Sainte, Catholique, Apostolique et Romaine.
Samedi Saint : Le Christ est Roi.
Homélie de Pâques.",2014,Salerans,01.01.2014,31.12.2014
/avr09,RETRAITES SPIRITUELLES,RETRAITE PASCALE : LA SAINTE MESSE – IL EST RESSUSCITÉ !,Rév. père M. AVRIL,"Toute la vie de Jésus est mariale et eucharistique.
La dernière messe. Prêtre à Jamais (25 ans de sacerdoce).
La prière par excellence de Jésus à son Père : le Canon de la messe.
La sainte Communion.
Les ténèbres du monde.
IV mystère douloureux : Jésus porte sa Croix.
Chemin de Croix Samedi Saint : Vie réparatrice.
Sermon de Pâques : Il est réssucité !",22 - 27.04.2016,,22.04.2016,27.04.2016
/lau2,RETRAITES SPIRITUELLES,DIEU EST PRÉSENT EN NOUS – RECONNAISSANCE ET PARDON – LA NOUVELLE ET L'ANCIENNE MESSE,M. l'abbé LAURENÇON,Récollection à Fabrègues,10.01.1999,Fabrègues,10.01.1999,
/tis09,RETRAITES SPIRITUELLES,JOURNÉE DE RÉCOLLECTION – MESSE – HOMÉLIE DU 1er DIMANCHE DE CARÊME – CONFÉRENCES – HOMMAGE AU PÈRE BARRIELLE - AUX VALAISANS – DIVERS CHANTS – CHEMIN DE CROIX,Mgr B. TISSIER DE MALLERAIS,Chemin de Croix par l’abbé P. Épiney.,28.02.1993,Riddes,28.02.1993,
/baud06,SAINTE MESSE,LA MESSE ET LA COMMUNION ? CONSEILS PRATIQUES ET RÉSOLUTIONS,M. l’abbé BAUDOT,Retraite de vie chrétienne.,1999 - 2005,Flavigny,,31.12.2005
/beau09,SAINTE MESSE,LA MESSE ET LA COMMUNION,M. l’abbé BEAUBLAT,Retraite de vie chrétienne.,23 - 29.07.2005,Flavigny,23.07.2005,29.07.2005
/bour07,SAINTE MESSE,"LA LITURGIE, SOURCE DE VIE CHRÉTIENNE",M. l’abbé BOURRAT,Retraite de vie chrétienne.,25 - 30.07.2004,Flavigny,25.07.2004,30.07.2004
/BOUR15,SAINTE MESSE,LA MESSE ET LA COMMUNION,M. l’abbé BOURRAT,Retraite de vie chrétienne.,21 - 27.07.2007,Flavigny,21.07.2007,27.07.2007
/bour02,SAINTE MESSE,"LA MESSE ET LA COMMUNION – LA LITURGIE, SOURCE DE VIE INTERIEURE",M. l’abbé BOURRAT,Retraite de vie chrétienne.,25 - 30.07.2003,Flavigny,25.07.2003,30.07.2003
/chat03,SAINTE MESSE,LA MESSE ET LA COMMUNION,M. l’abbé O. du CHATELET,Retraite de vie chrétienne.,28.07 - 01.08.1997,Pouilly-en-Auxois,28.07.1997,01.08.1997
/cma01,SAINTE MESSE,MESSE PONTIFICALE,Mgr B. TISSIER DE MALLERAIS,Congrès Marial (N° 1).,15 - 17.08.1996,Lourdes,15.08.1996,17.08.1996
/CT2,SAINTE MESSE,LA NOTION DE L’ANALOGIE ET LE SACRIFICE DE LA MESSE,M. l’abbé D. COUTURE,Le Cercle d’Études Catholiques “Christus Rex”,23.07.1993,Lauzon (Canada),23.07.1993,
/epi06,SAINTE MESSE,MESSE SOLENNELLE ET HOMÉLIE À LA PREMIÈRE MESSE DE M. L'ABBÉ GRENONn,M. l’abbé P. EPINEY,,,Riddes,,
/jj10,SAINTE MESSE,LA MESSE ET LA COMMUNION,Rév. père Jean-Joseph,Retraite de vie chrétienne.,22 - 28.07.2006,Flavigny,22.07.2006,28.07.2006
/lau6,SAINTE MESSE,"LA LITURGIE, SOURCE DE VIE CHRÉTIENNE – RENOUVELLEMENT DES PROMESSES DU BAPTÊME",M. l’abbé LAURENÇON,Retraite de vie chrétienne.,18 - 24.07.2009,Flavigny,18.07.2009,24.07.2009
/lau5,SAINTE MESSE,LA MESSE ET LA COMMUNION,M. l’abbé LAURENÇON,Retraite de vie chrétienne.,18 - 24.07.2009,Flavigny,18.07.2009,24.07.2009
/lau1,SAINTE MESSE,MESSE : DICIT DOMINUS – LE PÉCHÉ – L'APPEL DU CHRIST-ROI,M. l'abbé LAURENÇON,"Récollection, à Riddes",26.11.1995,Riddes,26.11.1995,
/mar12,SAINTE MESSE,LE TRÉSOR MÉCONNU PAR BEAUCOUP DE CATHOLIQUES : LE SAINT SACRIFICE DE LA MESSE,M. l’abbé A.N. MARET,,,Sion,,
/quil1,SAINTE MESSE,EXPLICATION DE LA MESSE (étude comparée des deux rites),M. l'abbé V. QUILTON,"Messe de St Pie V et Messe de Paul VI :
Un même rite avec des mots différents, ou deux rites étrangers l’un à l’autre ?
La réponse se trouve dans la liturgie elle même. Après une étude comparative de la signification de ces deux rites, la dernière cassette conclut.",24.10.01 – 28.11.01 – 01.02.02,Monthey,24.10.2001,
/quil2,SAINTE MESSE,"SYNTHÈSE D'EXPLICATION DE LA MESSE Monthey,",M. l'abbé V. QUILTON,,24.02.2002,Monthey,24.02.2002,
/rs11,SAINTE MESSE,LA LITURGIE,Retraite spirituelle 2015,"Retraite de vie chrétienne,
par le Révérend père Pierre",25 - 31.07.2015,F,25.07.2015,31.07.2015
/rs17,SAINTE MESSE,"LA LITURGIE, SOURCE DE VIE INTÉRIEURE",Retraite spirituelle 2015,"Retraite de vie chrétienne,
par le Révérend père Pierre",25 - 31.07.2015,Flavigny,25.07.2015,31.07.2015
/rs14,SAINTE MESSE,LA MESSE ET LA COMMUNION,Retraite spirituelle 2015,"Retraite de vie chrétienne,
par M. l’abbé P. TROADEC",25 - 31.07.2015,Flavigny,25.07.2015,31.07.2015
/ru02,SAINTE MESSE,GRANDEUR ET BEAUTE DE LA LITURGIE,M. l’abbe J.M. RULLEAU,,01.12.1991,"Séminaire Inter. St Pie X, Écône",01.12.1991,
/ru21,SAINTE MESSE,LE SYMBOLISME DANS LA LITURGIE,M. l’abbé J.-M. RULLEAU,,27.02.1995,"Instit. St-Grégoire le Grand, Lyon",27.02.1995,
/si19,SAINTE MESSE,THÉOLOGIE DE LA MESSE (6 conférences),M. l’abbé M. SIMOULIN,"L’unique Sacrifice Rédempteur.
L’oblation non sanglante : la Cène - la Messe.
Le Sacrifice : l’Offertoire.
Le Sacrifice : l’Immolation.
Le Sacrement et la Communion.
Le rite sacrificiel : Histoire et signification.",18.11.1996 au 26.05.1997,"Instit. St-Grégoire le Grand, Lyon",,
/sm1,SAINTE MESSE,MESSE BASSE DU CŒUR IMMACULÉ DE MARIE,Le prêtre célébrant,"Pour permettre à nos malades de s’unir quotidiennement au Saint Sacrifice de la Messe et les aider à offrir leurs souffrances en union avec les souffrances de Notre Sauveur.
(Par M. l’abbé J.-M.Tam)",31.05,Sion,,
/sm04,SAINTE MESSE,MESSE CHANTÉE DE LA FÊTE-DIEU,Les séminaristes,,,"Séminaire Inter. St Pie X, Écône",,
/sm02,SAINTE MESSE,MESSE CHANTÉE DE REQUIEM,Les séminaristes,"Messe de funérailles de Madame Maret, mamans des 3 abbés Maret
Psaume 50 : Miserere – Subvenite – Introït : Requiem æternam – Épître –Graduel – Trait – Évangile – Offertoire – Prèface – Sanctus – De Profundis (polyphonie) – Pater Noster – Agnus Dei – Confiteor – Lætatus sum – (polyphonie) – Lux æterna – De Profundis – Oraison – Postcommunion – Absoute – Libera me – Pater – Prières – In Paradisum",,"Séminaire Inter. St Pie X, Écône",,
/sm03,SAINTE MESSE,MESSE CHANTÉE DU SACRÉ-CŒUR,Les séminaristes,,,"Séminaire Inter. St Pie X, Écône",,
/sm12,SAINTE MESSE,MESSE ET VÊPRES DU DIMANCHE DE LÆTARE,Les séminaristes,,,"Séminaire Inter. St Pie X, Écône",,
/sm11,SAINTE MESSE,MESSE GRÉGORIENNE A ÉCÔNE,Les séminaristes,,,"Séminaire Inter. St Pie X, Écône",,
/tho08,SAINTE MESSE,"LA LITURGIE, SOURCE DE VIE CHRÉTIENNE",M. l’abbé THOUVENOT,Retraite de vie Chrétienne.,22 - 28.07.2006,Flavigny,22.07.2006,28.07.2006
/tis18,SAINTE MESSE,ORDINATIONS SACERDOTALES - MESSE GRÉGORIENNE DES SAINTS PIERRE ET PAUL,Mgr B. TISSIER DE MALLERAIS,,1989,Écône,01.01.1989,31.12.1989
/tou05,SAINTE MESSE,"LA LITURGIE, SOURCE DE VIE INTÉRIEURE – CONCLUSION",M. l’abbé Ph. TOULZA,Retraite de vie Chrétienne.,19.06.1994 - 07.1998 - 07.1999-2000,"Müllerhof, Pouilly-en-Auxois, Flavigny",19.06.1994,
/tr64,SAINTE MESSE,LA MESSE ET LA COMMUNION,M. l’abbé P. TROADEC,Retraite de vie Chrétienne. Conférence no. 12.,25 - 30.07.2004,Flavigny,25.07.2004,30.07.2004
/tr14,SAINTE MESSE,LE SAINT SACRIFICE DE LA MESSE,M. l’abbé P. TROADEC,,15.05.1995,"Instit. St-Grégoire le Grand, Lyon",15.05.1995,
/a14,SAINTE VIERGE,NOTRE-DAME ET LE SACERDOCE DE NOTRE-SEIGNEUR,M. l’abbé J.-P. ANDRÉ,Congrès Marial. (CMA 4),15 - 17.08.1996,Lourdes,15.08.1996,17.08.1996
/baud07,SAINTE VIERGE,"LA SAINTE VIERGE, MODÈLE DE LA FEMME CHRÉTIENNE",M. l’abbé BAUDOT,Retraite de vie chrétienne.,1999 - 2005,Flavigny,,31.12.2005
/BLA1,SAINTE VIERGE,NOTRE-DAME DE GUADALUPE OU LA CONVERSION DES ASTÈQUES À JÉSUS-CHRIST,M. F. BLANCHET,"Par le “Cercle d’études catholiques”
L’apparition est replacée dans le cadre historique et spirituel de l’époque : la civilisation aztèque, l’arrivée du christianisme, son développement, les conversions qui ont suivi.",17.07.1993,Lauzon (Canada),17.07.1993,
/BOU1,SAINTE VIERGE,LE MESSAGE DE NOTRE-DAME DE LA SALETTE,M. H. BOURGEOIS,"Mélanie Calvat, Bergère de la Salette.
Son enfance, une préparation providentielle à Apparition du 19 septembre 1846.
Quatorze années de privations, d’humiliations, de mauvais traitements, mais aussi de consolations et de soutiens miraculeux.
Mélanie, témoin et messagère de Notre-Dame de la Salette.
L’Apparition de la Très Sainte Vierge.
Face à l’opposition gallicane, soixante ans de persécutions, d’exil, de souffrances… et de protection divine.
Le Message de Notre-Dame de la Salette.
Le discours public.
Le Secret de Maximin, de Mélanie.
La Règle de l’Ordre de Notre-Dame.",1990,France,01.01.1990,31.12.1990
/BR2,SAINTE VIERGE,NOTRE-DAME DE GUADALUPE,Frère B. BONNET-EYMARD,Son image merveilleuse devant l’histoire et la science.,,Josselin,,
/BV1,SAINTE VIERGE,LES APPARITIONS DE NOTRE-DAME DE LA SALETTE,M. B. LOUBIER BONNET DE VILLER,,01.02.1997,Le Treilhou,01.02.1997,
/CAST10,SAINTE VIERGE,NOTRE-DAME ET LOUIS-MARIE GRIGNON DE MONTFORT,M. l’abbé CASTELAIN,Congrès Marial.,15 - 17.08.1996,Lourdes,15.08.1996,17.08.1996
/ch04,SAINTE VIERGE,NOTRE-DAME ET L’OECUMÉNISME,M. l’abbé E. du CHALARD,Congrès marial.,15 - 17.07.1996,Lourdes,15.07.1996,17.07.1996
/CHAT10,SAINTE VIERGE,LA TRÈS SAINTE VIERGE MARIE,M. l’abbé O. du CHATELET,Retraite de vie chrétienne.,26 - 31.07.1998,Pouilly-en-Auxois,26.07.1998,31.07.1998
/cma05,SAINTE VIERGE,CE QUE NOTRE-SEIGNEUR DOIT À NOTRE-DAME,M. l'abbé A. SÉLÉGNY,Congrès Marial (N° 5).,15 - 17.08.1996,Lourdes,15.08.1996,17.08.1996
/cma09,SAINTE VIERGE,LE ROSAIRE : SON HISTOIRE ET SA PRATIQUE,Rév. père M. DOMINIQUE O.P.,Remplace la K7 du Congrès Marial.,15 - 17.08.1996,Lourdes,15.08.1996,17.08.1996
/cma02,SAINTE VIERGE,NOTRE-DAME ET LE MYSTÈRE DE L'INCARNATION,Mgr B. TISSIER DE MALLERAIS,"Congrès Marial ( N° 2)
Introduction de M. l’abbé Putois.",15 - 17.08.1996,Lourdes,15.08.1996,17.08.1996
/cma10,SAINTE VIERGE,NOTRE-DAME ET SAINT ALPHONSE DE LIGUORI,Rév. pères SIM et ANTHONY,Congrès Marial (N° 10).,15 - 17.08.1996,Lourdes,15.08.1996,17.08.1996
/DEL1,SAINTE VIERGE,LA DÉVOTION AU CŒUR IMMACULÉ DE MARIE,M. l’abbé F. DELESTRE,Sermons du IVéme samedi et du Vème dimanche après Pâques.,08 - 09.05.1999,Bruxelles,08.05.1999,09.05.1999
/FAT1,SAINTE VIERGE,PÈLERINAGE DE LA FSSPX À FATIMA,Pèlerinage de la FSSPX à Fatima,"Interventions de Mgr B. Fellay, Mgr B. Tissiers de Mallerais, et les abbés Lorber et Labouche.",21 - 22.08.1997,Fatima,21.08.1997,22.08.1997
/ga03,SAINTE VIERGE,IMMACULÉE CONCEPTION – NOËL,Mgr de GALARRETA,,08 - 25.12.1994,"Séminaire Inter. St Pie X, Écône",08.12.1994,25.12.1994
/GOD3,SAINTE VIERGE,"MARIE, REINE DE FRANCE",M. l’abbé Ph. GODARD,,07.05.1998,"Institut Universitaire St-Grégoire le Grand, Lyon",07.05.1998,
/gre4,SAINTE VIERGE,LES MERVEILLES DU ROSAIRE,M. l’abbé GRENON,,,,,
/jj04,SAINTE VIERGE,"CONSEILS PRATIQUES ET RÉSOLUTIONS – LA SAINTE VIERGE, MODÈLE DE LA FEMME CHRÉTIENNE",Rév. père Jean-Joseph,Retraite de vie chrétienne.,20 - 25.07.2003,Flavigny,20.07.2003,25.07.2003
/jj017,SAINTE VIERGE,LA DÉVOTION ET LA CONSÉCRATION À MARIE,Rév. père Jean-Joseph,Retraite de vie chrétienne.,22 - 28.07.2008,Flavigny,22.07.2008,28.07.2008
/jj12,SAINTE VIERGE,"LA SAINTE VIERGE, MODÈLE DE LA FEMME CHRÉTIENNE",Rév. père Jean-Joseph,Retraite de vie chrétienne.,22 - 28.07.2006,Flavigny,22.07.2006,28.07.2006
/jj22,SAINTE VIERGE,LA VRAIE DÉVOTION À LA SAINTE VIERGE ET LMG DE MONTFORT,Rév. père Jean-Joseph,Retraite de vie chrétienne.,18 - 24.07.2009,Flavigny,18.07.2009,24.07.2009
/jj01,SAINTE VIERGE,LE DON DE FORCE – LA TRÈS SAINTE VIERGE MARIE,Rév. père Jean-Joseph,Retraite de vie chrétienne N° 7.,26.07 - 01.08.1998,Pouilly-en-Auxois,26.07.1998,01.08.1998
/jo19,SAINTE VIERGE,NOTRE-DAME ET LE MYSTÈRE DE LA REDEMPTION,M. l’abbé B. de JORNA,"Introduction de M. l’abbé Putois.
Congrès Marial.",15 - 17.08.1996,Lourdes,15.08.1996,17.08.1996
/KO1,SAINTE VIERGE,VIVRE UNI À MARIE,M. l’abbé M. KOLLER,,24.10.1992,"Montreux, Notre-Dame de Lépante",24.10.1992,
/las3,SAINTE VIERGE,CONCORDANCE DES SECRETS DE LA SALETTE ET DE FATIMA,M. A. de LASSUS,,10.11.1993,"Lauzon, Canada",10.11.1993,
/m1,SAINTE VIERGE,MEDJUGORJE - FATIMA - KIBEHO,Frère M. DE LA SAINTE TRINITE,"Conférence-débat : Les messages du Ciel à la terre.
Chaque enfant de Marie désire connaître sa Sainte Mère à la lumière de la doctrine infaillible de l’Église.",11.03.1985,Paris - Sorbonne,11.03.1985,
/MISM1,SAINTE VIERGE,MISSION MARIALE À SION,Rév. pères Laurent et Jean-Joseph,Abbé Wuilloud. Début 4ème conférence.,30.09 - 07.10.2006,Sion,30.09.2006,07.10.2006
/na2,SAINTE VIERGE,TOUT SUR FATIMA,M. l'abbé de NANTES,Le titre exprime le contenu de cette études très remarquable.,30 - 31.05.1981,Josselin,30.05.1981,31.05.1981
/NAU2,SAINTE VIERGE,RETRAITE AVEC JACINTHE ET LUCIE DE FATIMA,M. l’abbé M. NAULT,,14 - 15.01.1994,"Lauzon, Canada",14.01.1994,15.01.1994
/NAU1,SAINTE VIERGE,VISION DE L’ENFER DES TROIS ENFANTS DE FATIMA,M. l’abbé M. NAULT,Retraite.,07.06.2006,"Lauzon, Canada",07.06.2006,
/POR1,SAINTE VIERGE,"FATIMA, SES MESSAGES ET SES MYSTÈRES",M. l’abbe N. PORTAIL,,22.05.1995,"Institut Uni. St-Grégoire le Grand, Lyon",22.05.1995,
/POR3,SAINTE VIERGE,LES APPARITIONS MODERNES ET CONTEMPORAINES DE NOTRE-DAME EN FRANCE,M. l’abbé N. PORTAIL,,06.05.1996,"Institut Universitaire St-Grégoire le Grand, Lyon",06.05.1996,
/RE5,SAINTE VIERGE,FATIMA ET LE IIIème SECRET,Mme M. REBOUL,,09.12.1995,Caussade “Le Treilhou”,09.12.1995,
/RE8,SAINTE VIERGE,L’IMMACULÉE CONCEPTION,Mme M. REBOUL,"Sa nécessité pour la Rédemption.
Les apparitions autour de l’Immaculée Conception.
La dévotion au Cœur Immaculé.",18.06.2009,Monthey,18.06.2009,
/RE9,SAINTE VIERGE,LE NOUVEL ORDRE MONDIAL À LA LUMIÈRE DU VÉRITABLE SECRET DE FATIMA,Mme M. REBOUL,,02.10.2004,Limoge,02.10.2004,
/RE7,SAINTE VIERGE,NOTRE-DAME DE GUADALUPE,Mme M. REBOUL,"Ses apparitions en 1531 au Mexique.
Son portrait miraculeux.",05.12.2007,Paris,05.12.2007,
/RO2,SAINTE VIERGE,LE ROSAIRE – avec le Notre Père en latin,ROSAIRE (par un groupe de fidèles),"Mystères : Joyeux, Douloureux et Glorieux.
Litanies de la Sainte Vierge, Salve Regina, chants,
– Orgue de Valère, le plus ancien orgue jouable d’Europe",,Sion,,
/RO1,SAINTE VIERGE,LE ROSAIRE MÉDITÉ – tout en français,ROSAIRE (par un groupe de fidèles),"Mystères : Joyeux, Douloureux et Glorieux.
Litanies de la Ste Vierge, du Sacré-Cœur, chants, orgue…",,Sierre,,
/ro3,SAINTE VIERGE,ROSAIRE EN FRANÇAIS,ROSAIRE (par un groupe de fidèles),"Mystères Joyeux, Douloureux, Gloriaux
Salve Regina, Litanies de la Ste Vierge, chants divers",,,,
/ro4,SAINTE VIERGE,ROSAIRE EN LATIN,ROSAIRE (par un groupe de fidèles),"Mystères Joyeux, Douloureux et Glorieux.
Litanies de la Sainte Vierge, Salve Regina, chants…",,,,
/rs21,SAINTE VIERGE,LA VRAIE DEVOTION A LA TRÉS SAINTE VIERGE MARIE ET LES “DÉVOTIONS”,Retraite spirituelle 2015,"Retraite de vie chrétienne,
par M. l’abbé Patrick Troadec",25-31.07.2015,Flavigny,25.07.2015,31.07.2015
/rs19,SAINTE VIERGE,LE ROSAIRE,Retraite spirituelle 2015,"Retraite de vie spirituelle,
par M. l’abbé Baudot",25-31.07.2015,Flavigny,25.07.2015,31.07.2015
/ru29,SAINTE VIERGE,L’IMMACULÉ CONCEPTION,M. l’abbe J.M. RULLEAU,,04.04.2003,Riddes,04.04.2003,
/STD1,SAINTE VIERGE,LES APPARITIONS DE SAN DAMIANO (Italie),Révérend père PELLACANI,"Témoignage du père Pellecani, curé du lieu, avant et durant les premières années des apparitions.",,San Damiano,,
/t05,SAINTE VIERGE,ATTRIBUER LE MAXIMUM À LA TRÈS SAINTE VIERGE MARIE,M. l’abbé G.-M. TAM,Est-ce ou non la norme de la théologie catholique ?,01.07.1997,Sion,01.07.1997,
/THO12,SAINTE VIERGE,"LA SAINTE VIERGE, MODÈLE, DE LA FEMME CHRÉTIENNE",M. l’abbé THOUVENOT,Retraite de vie Chrétienne.,21 - 27.07.2007,Flavigny,21.07.2007,27.07.2007
/tis02,SAINTE VIERGE,LA PLACE DE LA VIERGE MARIE DANS LA VIE SACERDOTALE,Mgr B. TISSIER DE MALLERAIS,Pour les 40 ans de sacerdoce du Révérend père J.-J. Marziac.,,Caussade,,
/TOU10,SAINTE VIERGE,"LA LITUREGIE, SOURCE DE VIE CHRÉTIENNE - LA VIERGE MARIE, MODÈLE DE LA FEMME CHRÉTIENNE",M. l’abbé Ph. TOULZA,Retraite de vie Chrétienne. Conférence no 17 - 20.,22 - 27.07.2002,Flavigny,22.07.2002,27.07.2002
/tr43,SAINTE VIERGE,ANNONCIATION ET L’ANGÉLUS,M. l’abbé P. TROADEC,Congrès Marial.,12 - 16.08.1998,Lourdes,12.08.1998,16.08.1998
/tr45,SAINTE VIERGE,DEVENIR MARIE TOUT EN RESTANT MARTHE,M. l’abbé P. TROADEC,Retraite de vie Chrétienne.,18 - 24.07.1999,Flavigny,18.07.1999,24.07.1999
/tr59,SAINTE VIERGE,LA JEUNE FILLE CATHOLIQUE À L’ÉCOLE DE NOTRE-DAME,M. l’abbé P. TROADEC,Retraite de vie Chrétienne. Conférence no 10.,20 - 25.07.2003,Flavigny,20.07.2003,25.07.2003
/tr66,SAINTE VIERGE,"LA SAINTE VIERGE, MODÈLE DE LA FEMME CHRÉTIENNE",M. l’abbé P. TROADEC,Retraite de vie Chrétienne. Conférence no 20.,25 - 30.07.2004,Flavigny,25.07.2004,30.07.2004
