url,category,title,author,description,date,place,date_from,date_to
/cha13,MUSIQUE,CHANTE CROISÉ,Par les enfants de la Croisade Eucharistique,"Chante Croisé.
A vous Jésus ma journée.
O mon Jésus je m’engage.
De toute son Ame.
Le Noël des Croisés.
Le Sourire.
Vive la Croisade.
Je veux t’aimer sans cesse.
Loué soit à tout instant.
Simple merci.
Je suis Croisé.
Trois p’tits Croisés.
Hymne de la Croisade.
A vous, à vous le cœur des Croisés.
Fais ton trésor, Sois notre force, Bénis notre Croisade.",,"Séminaire International St Pie X, Écône",,
/cha01,MUSIQUE,CHANTS CATHOLIQUES TRADITIONNELS (N° 1),Par les séminariste d'Écône,"15 chants : – 11 par les séminariste d’Écône et 4 par des fidèles – chantés en la chapelle de la Sainte Famille
Sainte Vierge, ô ma mère
Vous êtes sans pareille
Salve Regina
Les saints et les anges
Chez nous soyez Reine
Panis Angelicum
C’est le mois de Marie.
O ma Reine, ô Vierge Marie
O Filii (français)
O l’Auguste Sacrement (3 couplets)
O Jésus doux et humble de Cœur
O Saint-Esprit
Sur la patène
J’irai la voir un jour
Ave de Fatima",,Sion,,
/cha02,MUSIQUE,CHANTS CATHOLIQUES TRADITIONNELS (N° 2),Par les séminariste d'Écône,"12 chants : par les séminariste d’Écône en la chapelle de la Sainte Famille
Te Deum
Veni Creator
Magnificat
Le voici l’Agneau si doux
O l’Auguste Sacrement (6 couplets).
Venez divin Messie
Dans une étable obscure
Adeste fideles
Il est né le Divin Enfant
Vive Jésus, vive sa croix
Victoire, tu régnera
Jésus notre Maître est ressuscité",,Sion,,
/cha03,MUSIQUE,CHANTS CATHOLIQUES TRADITIONNELS (N° 3),Par les séminariste d'Écône,"19 chants : en la chapelle de la Sainte Famille
Vexilla Regis
O lux beatam
Pange lingua
Tantum ergo
Regina Cæli
Ave Verum
Attende Domine
Lauda Sion Salvatorem
O Filii et Filiæ (Latin)
Laudate Mariam (Latin)
Ave Maria
Alma Redemptoris Mater (Solennel)
Ave Regina Cælorum (Solennel)
Ave Maris Stella
Ubi
Caritas
Adoro Te devote
O Salutaris Hostia
Lauda Jerusalem
Acclamations carolingiennes",,Sion,,
/cha04,MUSIQUE,CHANTS CATHOLIQUES TRADITIONNELS (N° 4),Par les séminaristes d'Écône,"15 chants en la chapelle de la Sainte Famille à Sion
Laudate Mariam (Français)
Tandis que le monde proclame
Nous voulons Dieu
Je crois en Toi mon Dieu
Devant Vous je m’engage
C’est le mois de Marie
Cum Sancto Spiritu (Tiré du Gloria de Vivaldi)
Sancte Pie Decime
Orgue
Stabat Mater
Salve Mater Misericordiae
Christus Vincit
Angelus
Sacri solemnis
Benedictus
Sancte Pie Decime
Orgue",,Sion,,
/CHA12,MUSIQUE,CHRISTUS VINCIT,Chœur des séminaristes d'Écône,"Mgr Lefebvre (fête du Christ-Roi, 30.10.88).
L’attente des nations.
Veni Domine. Ad Te levavi. Introït du 1er dimanche de l’Avent. O Rex gentium. Grande antienne “o” du 22 décembre.
La naissance du Sauveur. Facta est. Dominus dixit ad me. Puer natus est. Adeste fideles. Ecce advenit. Introït de l’Epiphanie.
Les conquêtes du Roi-Messie. Attende Domine. Gloria Laus. Vexilla Regis. Hymne du temps de la Passion. Proprio filio suo. Christus factus est.
La gloire du Ressuscité. Confitemini. Alleluia. Vigile Pascale. Resurrexi. Introït du dimanche de Pâques. O Filii et filiae (J. Tisserand XVe siècle). O Rex Gloriae. Notre Roi céleste. Christum Regem. Polyphonie (Guilloux) Dignus est. Te sæculorum.
Mgr Lefebvre (deuxième extrait).
Christus Vincit, Acclamations carolingiennes.",,Oberriet,,
/cha10,MUSIQUE,LAUDATE MARIAM,Chœur des séminaristes d'Écône,"Messe de la Sainte Vierge
Introït. Salve Sancta Parens. Kyrie. Gloria IX cum jubilo. Graduel. Benedicta. Alleluia. Epître. Évangile.
Homélie de Mgr Lefebvre en la Fête de l’Immaculée Conception (8.12.1977)
Offertoire. Ave Maria. Préface. Sanctus. Agnus Dei. Communion. Beata viscera. Ite Missa est.
Salve Regina (solennel). Ave Maria (motet). Inviolata (motet). O Gloriosa Virginum (polyphonie). Alma Redemptoris Mater (solennel). Virgo Dei Genitrix (motet). Maria Mater gratiae (motet). O Plena gratia (polyphonie). Angelus Domini nuntiavit Mariae. Ave Regina caelorum (solennel). Salve Mater (motet). Sub Tuum praesidium (motet). Litanies de la Très Sainte Vierge. Regina Cæli laetare (solennel). Tota pulchra es (motet). Regina Cæli, jubila (polyphonie). Hymne Ave Maris Stella (solennel). Magnificat de l’Immaculée Conception .",,"Séminaire International St Pie X, Écône",,
/cha16,MUSIQUE,MOTETS DE PELERINAGE,Par le cœur de Russie Blanche,Polyphonie.,,Zaitzkofen,,
/cha11,MUSIQUE,O SALUTARIS HOSTIA,Chœur des séminaristes d'Écône,"Messe du Très Saint Sacrement
Introït. Cibavit. Graduel : Oculi. Alleluia : Caro mea; Lauda Sion.
Homélie de Mgr Lefebvre (Fête Dieu 1976)
Offertoire : Sacerdotes. Communion : Quotiescumque. Polyphonie : O Domine.
Salut du Très Saint Sacrement.
Hymne : Adoro te devote. Polyphonie : Monstra te esse Matrem. Oremus pro Pontifice nostro. Tantum ergo (moderne). Ubi Caritas. Christum Regem. Pange lingua, Jesu dulcis memoria. Motet : Ave Verum. Hymne : Verbum supernum. Antiennes O sacrum. O quam suavis. Hymne : Sacris solemnis. Benedictus. Antienne : Adoremus in æternum. O Salutaris Hostia. Lauda Jerusalem.",,"Séminaire International St Pie X, Écône",,
/cha14,MUSIQUE,PAR L'AVE MARIA,Par les enfants de la Croisade Eucharistique,"Acte d’offrande.
Angelus.
Benedicite.
Action de grâces.
Prière patriotique.
Kyrie des Gueux.
Les bleus sont là.
Je vous salue Marie de Chartres.
Le Roi Louis.
La Cavalcade.
La messe en mer.
Sérénade.
Il s’appelait Jean-Pierre.
Le vieux chalet.
Un gai luron des Flandres.
Catherine était chrétienne.
La Belle vie.
Ô Vierge Sainte.
Par l’Ave Maria.",,"Séminaire International St Pie X, Écône",,
/org1,MUSIQUE,CONCERT D'ORGUE,Chorale,,1996,Oberriet,01.01.1996,31.12.1996
/beau04,NOTRE SEIGNEUR,NOTRE SEIGNEUR JÉSUS-CHRIST – L'HUMILITÉ ET L'OBÉISSANCE,M. l’abbé BEAUBLAT,Retraite de vie chrétienne.,07.2004,Flavigny,01.07.2004,31.07.2004
/BOUR13,NOTRE SEIGNEUR,NOTRE-SEIGNEUR JÉSUS-CHRIST,M. l’abbé BOURRAT,Retraite de vie chrétienne.,21 - 27.07.2007,Flavigny,21.07.2007,27.07.2007
/bour01,NOTRE SEIGNEUR,NOTRE-SEIGNEUR JÉSUS-CHRIST – LA GRÂCE,M. l’abbé BOURRAT,Retraite de vie chrétienne.,25 - 30.07.2003,Flavigny,25.07.2003,30.07.2003
/chat05,NOTRE SEIGNEUR,JÉSUS EST NOTRE MODÉLE DANS LA PRATIQUE DES VERTUS,M. l’abbé O. du CHATELET,Retraite de vie chrétienne.,28.07 - 01.08.1997,Pouilly-en-Auxois,28.07.1997,01.08.1997
/chat09,NOTRE SEIGNEUR,LE SACRÉ-COEUR,M. l’abbé O. du CHATELET,Retraite de vie chrétienne.,26 - 31.07.1998,Pouilly-en-Auxois,26.07.1998,31.07.1998
/HE2,NOTRE SEIGNEUR,"COMMENT POSSÉDER LA VIE ÉTERNELLE ? PAR LA VIE INTÉRIEURE, QUI S’ACQUIERT PAR LA CONNAISSANCE DE NOTRE-SEIGNEUR JÉSUS-CHRIST",M. l’abbé G. HERRBACH,"Série de 3 conférences, carême.",2003,Sion,01.01.2003,31.12.2003
/JACOT2,NOTRE SEIGNEUR,LA FONDATION DE L’ÉGLISE PAR NOTRE-SEIGNEUR JÉSUS-CHRIST,M. l’abbé M. JACOT,Conférences de “Constantia”.,2004,Sion,01.01.2004,31.12.2004
/jj13,NOTRE SEIGNEUR,NOTRE-SEIGNEUR JÉSUS-CHRIST – LE COMBAT SPIRITUEL,Rév. père Jean-Joseph,Retraite de vie chrétienne.,22 - 28.07.2008,Flavigny,22.07.2008,28.07.2008
/KO3,NOTRE SEIGNEUR,L’ENFANT-JÉSUS DE PRAGUE,M. l’abbé M. KOLLER,Récollection.,18.12.1999,"Unieux,",18.12.1999,
/rs04,NOTRE SEIGNEUR,NOTRE SEIGNEUR JÉSUS-CHRIST,Retraite spirituelle 2015,"Retraite de vie chrétienne,
par M. l’abbé Patrick Troadec",25-31.07.2015,Flavigny,25.07.2015,31.07.2015
/si46,NOTRE SEIGNEUR,ANNONCES ET FIGURES DE NOTRE-SEIGNEUR DANS L’ANCIEN TESTAMENT,M. l’abbé M. SIMOULIN,,20.10.1991,Écône,20.10.1991,
/si48,NOTRE SEIGNEUR,"JÉSUS-CHRIST, VRAI DIEU ET VRAI HOMME",M. l’abbé M. SIMOULIN,,22.12.1991,Écône,22.12.1991,
/si49,NOTRE SEIGNEUR,L’ÂME DE NOTRE-SEIGNEUR JÉSUS-CHRIST,M. l’abbé M. SIMOULIN,,26.01.1992,Écône,26.01.1992,
/si50,NOTRE SEIGNEUR,LA PRIÈRE DE NOTRE-SEIGNEUR JÉSUS-CHRIST,M. l’abbé M. SIMOULIN,,16.02.1992,Écône,16.02.1992,
/si53,NOTRE SEIGNEUR,LA ROYAUTÉ DE NOTRE-SEIGNEUR JÉSUS-CHRIST,M. l’abbé M. SIMOULIN,,24.05.1992,Écône,24.05.1992,
/si54,NOTRE SEIGNEUR,LA VIE DE NOTRE-SEIGNEUR (1),M. l’abbé M. SIMOULIN,La Nativité.,10.1992 - 06.1994,Écône,,30.06.1994
/si63,NOTRE SEIGNEUR,LA VIE DE NOTRE-SEIGNEUR (10) Les entretiens de Notre-Seigneur après la cène,M. l’abbe M. SIMOULIN,,19.12.199,"Séminaire Inter. St Pie X, Écône",19.12.199,
/si64,NOTRE SEIGNEUR,LA VIE DE NOTRE-SEIGNEUR (11) Agonie de Notre-Seigneur au jardin des oliviers,M. l’abbe M. SIMOULIN,,16.01.1994,"Séminaire Inter. St Pie X, Écône",16.01.1994,
/si65,NOTRE SEIGNEUR,LA VIE DE NOTRE-SEIGNEUR (12) Les procès de Notre-Seigneur,M. l’abbe M. SIMOULIN,,20.02.1994,"Séminaire Inter. St Pie X, Écône",20.02.1994,
/si66,NOTRE SEIGNEUR,LA VIE DE NOTRE-SEIGNEUR (13) Le Chemin de la Croix,M. l’abbe M. SIMOULIN,,20.03.1994,"Séminaire Inter. St Pie X, Écône",20.03.1994,
/si67,NOTRE SEIGNEUR,LA VIE DE NOTRE-SEIGNEUR (14) Notre-Seigneur Jésus-Christ après sa mort,M. l’abbé M. SIMOULIN,,15.05.1994,Riddes,15.05.1994,
/si68,NOTRE SEIGNEUR,LA VIE DE NOTRE-SEIGNEUR (15) Notre-Seigneur dans sa gloire,M. l’abbé M. SIMOULIN,,19.06.1994,Écône,19.06.1994,
/si55,NOTRE SEIGNEUR,LA VIE DE NOTRE-SEIGNEUR (2) La vie cachée,M. l’abbé M. SIMOULIN,,15.11.1992,Écône,15.11.1992,
/si56,NOTRE SEIGNEUR,LA VIE DE NOTRE-SEIGNEUR (3) Saint Jean-Baptiste et le baptême de Notre-Seigneur,M. l’abbé M. SIMOULIN,,20.12.1992,Écône,20.12.1992,
/si57,NOTRE SEIGNEUR,LA VIE DE NOTRE-SEIGNEUR (4) La tentation de Notre- Seigneur au désert,M. l’abbé M. SIMOULIN,,21.01.1993,Écône,21.01.1993,
/si58,NOTRE SEIGNEUR,LA VIE DE NOTRE-SEIGNEUR (5) Les débuts de la vie publique - Les premiers disciples - Les noces de Cana,M. l’abbé M. SIMOULIN,,21.02.1993,Écône,21.02.1993,
/si59,NOTRE SEIGNEUR,LA VIE DE NOTRE-SEIGNEUR (6) Les miracles de Jésus-Christ (I),M. l’abbé M. SIMOULIN,,16.05.1993,Écône,16.05.1993,
/si60,NOTRE SEIGNEUR,LA VIE DE NOTRE-SEIGNEUR (7) Les miracles de Jésus-Christ (II),M. l’abbé M. SIMOULIN,,20.06.1993,Écône,20.06.1993,
/si61,NOTRE SEIGNEUR,LA VIE DE NOTRE-SEIGNEUR (8) Des Rameaux au Mercredi-Saint,M. l’abbe M. SIMOULIN,,17.10.1993,"Séminaire Inter. St Pie X, Écône",17.10.1993,
/si62,NOTRE SEIGNEUR,LA VIE DE NOTRE-SEIGNEUR (9) Le Jeudi-Saint,M. l’abbé M. SIMOULIN,,21.11.1993,Écône,21.11.1993,
/si51,NOTRE SEIGNEUR,LE SACERDOCE DU CHRIST,M. l’abbé M. SIMOULIN,,15.03.1992,Écône,15.03.1992,
/si52,NOTRE SEIGNEUR,LE SACERDOCE ET LA PASSION DE NOTRE-SEIGNEUR - LA COMPASSION DE MARIE,M. l’abbé M. SIMOULIN,,05.04.1992,Écône,05.04.1992,
/tho01,NOTRE SEIGNEUR,NOTRE-SEIGNEUR JÉSUS-CHRIST,M. l’abbé THOUVENOT,Retraite de vie Chrétienne.,25 - 30.07.2004,Flavigny,25.07.2004,30.07.2004
/tou04,NOTRE SEIGNEUR,"NOTRE-SEIGNEUR JÉSUS-CHRIST, CAUSE DE NOTRE SALUT",M. l’abbé Ph. TOULZA,Retraite de vie Chrétienne.,19.06.1994 - 07.1998 - 07.1999-2000,"Müllerhof, Pouilly-en-Auxois, Flavigny",19.06.1994,
/tr52,NOTRE SEIGNEUR,CONNAÎTRE NOTRE-SEIGNEUR JÉSUS-CHRIST,M. l’abbé P. TROADEC,Retraite de vie Chrétienne. Conférences no 1 - 4.,22 - 27.07.2002,Flavigny,22.07.2002,27.07.2002
/tr72,NOTRE SEIGNEUR,INTRODUCTION - NOTRE-SEIGNEUR JÉSUS-CHRIST,M. l’abbé P. TROADEC,Retraite de la vie Chrétienne.,22 - 28.07.2006,Flavigny,22.07.2006,28.07.2006
/tr19,NOTRE SEIGNEUR,LA CONCEPTION DE NOTRE-SEIGNEUR (1),M. l’abbé P. TROADEC,Série de 7 conférences.,20.11.1995,"Institut Universitaire St-Grégoire le Grand, Lyon",20.11.1995,
/TR20,NOTRE SEIGNEUR,LA NATIVITÉ DE NOTRE-SEIGNEUR (2),M. l’abbé P. TROADEC,"Série de 7 conférences
Vie de Notre-Seigneur.",20.11.1995,"Institut Universitaire St-Grégoire le Grand, Lyon",20.11.1995,
/TR24,NOTRE SEIGNEUR,LA RÉSURRECTION DE NOTRE SEIGNEUR (6),M. l’abbé P. TROADEC,"Série de 7 conférences
Vie de Notre-Seigneur.",20.04.1996,"Institut Universitaire St-Grégoire le Grand, Lyon",20.04.1996,
/tr25,NOTRE SEIGNEUR,LA VIE DE NOTRE-SEIGNEUR AU CIEL (7),M. l’abbé P. TROADEC,"Série de 7 conférences
Vie de Notre-Seigneur.",20.05.1996,"Institut Universitaire St-Grégoire le Grand, Lyon",20.05.1996,
/tr22,NOTRE SEIGNEUR,LA VIE PUBLIQUE DE NOTRE-SEIGNEUR (4),M. l’abbé P. TROADEC,"Série de 7 conférences
Vie de Notre-Seigneur.",20.02.1996,"Institut Universitaire St-Grégoire le Grand, Lyon",20.02.1996,
/tr31,NOTRE SEIGNEUR,MEDITATIONS SUR NOTRE-SEIGNEUR JÉSUS-CHRIST,M. l’abbé P. TROADEC,,28.07 - 01.08.1997,Pouilly-en-Auxois,28.07.1997,01.08.1997
/tr28,NOTRE SEIGNEUR,NOTRE PARTICIPATION À LA ROYAUTÉ ET AU SACRIFICE DU CHRIST,M. l’abbé P. TROADEC,,06.06 et 03.02.1992,"Institut Universitaire St-Grégoire le Grand, Lyon",,
/tr27,NOTRE SEIGNEUR,NOTRE PARTICIPATION À LA SAINTETÉ ET À LA CONSÉCRATION DU CHRIST,M. l’abbé P. TROADEC,,18.11 et 16.12.1991,"Institut Universitaire St-Grégoire le Grand, Lyon",,
/tr21,NOTRE SEIGNEUR,NOTRE-SEIGNEUR JÉSUS-CHRIST (3),M. l’abbé P. TROADEC,"Série de 7 conférences
Vie de Notre-Seigneur.",20.11.1995,"Institut Universitaire St-Grégoire le Grand, Lyon",20.11.1995,
/a05,PASSION,LA PASSION DE NOTRE-SEIGNEUR JÉSUS-CHRIST,M. l’abbé J.-P. ANDRÉ,,09.07.1993,Le Treilhou,09.07.1993,
/a07,PASSION,LE CHEMIN DE CROIX,M. l’abbé J.-P. ANDRÉ,,09.07.1993,Le Treilhou,09.07.1993,
/a15,PASSION,LES ANNONCES DE LA PASSION - POURQUOI LA PASSION ? - POURQUOI LA MORT DU SAUVEUR SUR UNE CROIX ?,M. l’abbé J.-P. ANDRE,Conférences de carême.,11 - 12 - 13.04.2003,Chartres,11.04.2003,13.04.2003
/ba19,PASSION,RÉFLEXION SUR LES ÉVANGILES DE LA PASSION,M. l’abbé J. BAYOT,,10.04.1995,"Institut Universitaire St Pie X, Paris",10.04.1995,
/BAUD10,PASSION,LA PASSION DE NOTRE-SEIGNEUR JÉSUS-CHRIST,M. l’abbé BAUDOT,Retraite de vie chrétienne.,1999 - 2005,Flavigny,,31.12.2005
/BAUD21,PASSION,LA PASSION DE NOTRE-SEIGNEUR JÉSUS-CHRIST,M. l’abbé BAUDOT,Retraite de vie chrétienne.,22 - 28.07.2008,Flavigny,22.07.2008,28.07.2008
/BAUD23,PASSION,LA PASSION ET LA CROIX DANS LA VIE CHRÉTIENNE - LE ROSAIRE,M. l’abbé BAUDOT,Retraite de vie chrétienne.,22 - 28.07.2008,Flavigny,22.07.2008,28.07.2008
/beau05,PASSION,"LA PASSION DE NOTRE SEIGNEUR JÉSUS-CHRIST – LA LITURGIE, SOURCE DE VIE INTÉRIEURE",M. l’abbé BEAUBLAT,Retraite de vie chrétienne.,07.2004,Flavigny,01.07.2004,31.07.2004
/beau06,PASSION,LA PASSION ET LA CROIX DANS LA VIE CHRÉTIENNE,M. l’abbé BEAUBLAT,Retraite de vie chrétienne.,07.2004,Flavigny,01.07.2004,31.07.2004
/BOUR11,PASSION,LA PASSION DE NOTRE SEIGNEUR JÉSUS-CHRIST – CONCLUSION DE RETRAITE,M. l’abbé BOURRAT,Retraite de vie chrétienne.,22 - 28.07.2006,Flavigny,22.07.2006,28.07.2006
/bour08,PASSION,PASSION ET CROIX DANS LA VIE CHRÉTIENNE,M. l’abbé BOURRAT,Retraite de vie chrétienne.,25 - 30.07.2004,Flavigny,25.07.2004,30.07.2004
/BR1,PASSION,LE SAINT SUAIRE DE TURIN : PREUVE DE LA MORTE ET LDE LA RÉSURCTION DU CHRIST,Frère B. BONNET-EYMARD,Conférence historique et scientifique.,,Josselin,,
/BR3,PASSION,LE SAINT SUAIRE EST AUTHENTIQUE,Frère B. BONNET-EYMARD,"Études scientifiques, après l’épreuve au carbone.",25.11.1990,"Paris, Salles de la Mutualité.",25.11.1990,
/DOM1,PASSION,LES RELIQUES DE LA PASSION DU CHRIST,M. B. de DOMPSURE,"IIème Colloque de l’Institut Saint Grégoire le Grand
“2000 ans de christianisme, questions actuelles”",18.03.2000,"Institut Universitaire St Grégoire le Grand, Lyon",18.03.2000,
/epi05,PASSION,CHEMIN DE CROIX,M. l’abbé P. EPINEY,,10.11.1991,Riddes,10.11.1991,
/epi01,PASSION,CHEMIN DE CROIX – CHAPELET EN LATIN,M. l’abbé P. EPINEY,"1) Récollection à Riddes.
2) Chapelet par les séminaristes de Zaitzkofen.",,Riddes,,
/EPI10,PASSION,CHEMIN DE CROIX – SALUT DU SAINT SACREMENT – ORGUE,M. l’abbé P. EPINEY,,,Riddes,,
/epi07,PASSION,CHEMIN DE CROIX ET SALUT DU TRÈS SAINT SACREMENT,M. l’abbé P. EPINEY,,27.11.1994,Riddes,27.11.1994,
/epi03,PASSION,LES SAINTES PLAIES DE NOTRE-SEIGNEUR JÉSUS-CHRIST,M. l’abbé P. EPINEY,,01.04.1990,CAROUGE,01.04.1990,
/epi02,PASSION,MEDITATION SUR LE CHEMIN DE CROIX,M. l’abbé P. EPINEY,,1988,Riddes,01.01.1988,31.12.1988
/jj07,PASSION,LA PASSION DE NOTRE SEIGNEUR JÉSUS-CHRIST,Rév. père Jean-Joseph,Retraite de vie chrétienne.,23 - 29.07.2005,Flavigny,23.07.2005,29.07.2005
/lov15,PASSION,LA CROIX DE JÉSUS,M. l’abbé Ph. LOVEY,6 Conférences de Carême.,2007,"Sion, Église de la Saint Famille",01.01.2007,31.12.2007
/MA1,PASSION,LA PASSION DE NOTRE SEIGNEUR JESUS-CHRIST,Rev. Pere J.J. MARZIAC,Conférence de retraite.,,"Le Treilhou, Caussade",,
/rs18,PASSION,LA PASSION ET LA CROIX DANS LA VIE CHRÉTIENNE,Retraite spirituelle 2015,"de vie chrétienne,
par le Rév. père Pierre",25-31.07.2015,Flavigny,25.07.2015,31.07.2015
/TAE1,PASSION,LE SAINT SUAIRE DE TURIN ET LE CARBONE 14,MM. D. TASSOT et G. EDEL,,04.12.1989,"Instit. Universitaire St-Pie X, Paris",04.12.1989,
/tho03,PASSION,LA PASSION DE NOTRE-SEIGNEUR JÉSUS-CHRIST,M. l’abbé THOUVENOT,Conférence de vie Chrétienne. Conférence no 13.,25 - 30.07.2004,Flavigny,25.07.2004,30.07.2004
/THO11,PASSION,LA PASSION DE NOTRE-SEIGNEUR JÉSUS-CHRIST,M. l’abbé THOUVENOT,Retraite de vie Chrétienne.,21 - 27.07.2007,Flavigny,21.07.2007,27.07.2007
/tou08,PASSION,L'ÉCRITURE SAINTE - LA PASSION DE NOTRE-SEIGNEUR JÉSUS-CHRIST,M. l’abbé Ph. TOULZA,Retraite de vie Chrétienne. Conférences no 5 - 13.,22 - 27.07.2002,Flavigny,22.07.2002,27.07.2002
/tr23,PASSION,LA PASSION DE NOTRE-SEIGNEUR (5),M. l’abbé P. TROADEC,"Série de 7 conférences
Vie de Notre-Seigneur.",20.03.1996,"Institut Universitaire St-Grégoire le Grand, Lyon",20.03.1996,
/tr34,PASSION,LA PASSION DE NOTRE-SEIGNEUR JÉSUS-CHRIST,M. l’abbé P. TROADEC,-,28.07 - 01.08.1997,Pouilly-en-Auxois,28.07.1997,01.08.1997
/tr56,PASSION,LA PASSION ET LA CROIX DANS LA VIE CHRÉTIENNE,M. l’abbé P. TROADEC,Retraite de vie Chrétienne. Conférence no 18.,22 - 27.07.2002,Flavigny,22.07.2002,27.07.2002
/tr40,PASSION,MÉDITATION DE LA PASSION DE NOTRE SEIGNEUR JÉSUS-CHRIST,M. l’abbé P. TROADEC,Retraite de vie Chrétienne.,26.07 - 01.08.1998,Pouilly-en-Auxois,26.07.1998,01.08.1998
/tr74,PASSION,PASSION ET CROIX DANS LA VIE CHRÉTIENNE,M. l’abbé P. TROADEC,Retraite de la vie Chrétienne.,22 - 28.07.2006,Flavigny,22.07.2006,28.07.2006
/BER1,PHILOSOPHIE,LA PHILOSOPHIE DE LA RÉVOLUTION ET LES DROITS DE L'HOMME,M. l'Amiral M. Berger,,10.11.1993,Lauzon (Canada),10.11.1993,
/cou09,PHILOSOPHIE,DESCARTES,M. E. COUVERT,,06.03.1995,"Institut Universitaire St Grégoire le Grand, Lyon",06.03.1995,
/cou08,PHILOSOPHIE,LA RENAISSANCE DU THOMISME,M. E. COUVERT,,15.11.1993,"Institut Universitaire St Grégoire le Grand, Lyon",15.11.1993,
/CT1,PHILOSOPHIE,LA NÉCESSITE DU LANGAGE SCOLASTIQUE POUR GARDER LA FOI,M. l’abbé D. COUTURE,Le Cercle d’Études Catholiques “Christus Rex”.,23.07.1993,Lauzon (Canada),23.07.1993,
/DUVE2,PHILOSOPHIE,LA DIALECTIQUE,M. DUVERGER,Session d’étude.,06 - 10-07.1992,Flavigny,06.07.1992,10.07.1992
/LO15,PHILOSOPHIE,Éléments de philosophie (1) LA LOGIQUE,M. l’abbe A. LORANS,Série de 7 conférences (LO 21 à 27) “Éléments de philosophie”,22.11.1993,"Institut Uni. St Pie X, Paris",22.11.1993,
/lo22,PHILOSOPHIE,Éléments de philosophie (2) LA PHILOSOPHIE DE LA NATURE,M. l'abbé A. LORANS,"Éléments de philosophie
Série de 7 conférences (LO 21 à 27)",20.12.1993,"Institut Uni. St Pie X, Paris",20.12.1993,
/lo23,PHILOSOPHIE,Éléments de philosophie (3) LA PSYCHOLOGIE,M. l'abbé A. LORANS,"Éléments de philosophie
Série de 7 conférences (LO 21 à 27)",24.01.1994,"Institut Uni. St Pie X, Paris",24.01.1994,
/lo24,PHILOSOPHIE,Éléments de philosophie (4) Y A-T-IL UNE VÉRITÉ ?,M. l'abbé A. LORANS,"Éléments de philosophie
Série de 7 conférences (LO 21 à 27)",28.02.1994,"Institut Uni. St Pie X, Paris",28.02.1994,
/lo25,PHILOSOPHIE,Éléments de philosophie (5) - PEUT-ON SE PASSER DE MÉTAPHYSIQUE ?,M. l'abbé A. LORANS,"Éléments de philosophie
Série de 7 conférences (LO 21 à 27)",14.03.1994,"Institut Uni. St Pie X, Paris",14.03.1994,
/lo26,PHILOSOPHIE,Éléments de philosophie (6) PREUVES DE L'EXISTENCE DE DIEU,M. l'abbé A. LORANS,"Éléments de philosophie
Série de 7 conférences (LO 21 à 27)",25.04.1994,"Institut Uni. St Pie X, Paris",25.04.1994,
/lo27,PHILOSOPHIE,Éléments de philosophie (7) LA MORALE,M. l'abbé A. LORANS,"Éléments de philosophie
Série de 7 conférences (LO 21 à 27)",25.04.1994,"Institut Uni. St Pie X, Paris",25.04.1994,
/ru25,PHILOSOPHIE,COURS DE PHILOSOPHIE (42 cours ),M. l'abbé J.-M. RULLEAU,"42 cours de 50 minutes
Physique d’Aristote.
Notions générales.
L’âme humaine.",1997 - 1998,"Séminaire Inter. St Pie X, Écône",,31.12.1998
/ru24,PHILOSOPHIE,ÉLÉMENTS DE PHILOSOPHIE POLITIQUE (24 cours),M. l’abbé J.-M. RULLEAU,24 cours de 50 minutes,1997 - 1998,"Séminaire Inter. St Pie X, Écône",,31.12.1998
/ru22,PHILOSOPHIE,INTRODUCTION A LA PHILOSOPHIE (27 cours),M. l’abbé J.-M. RULLEAU,"27 cours de 50 min
Introduction – Histoire et présocratiques – Parménide et Héraclite : 2 pôles – Les Atomistes, les Sophistes et Socrate – Platon – Les 4 questions fondamentales – Aristote, les Stoïciens, les Épicuriens et les Sceptiques – Le Néo-Platonisme – Philosophie de la philosophie et définitions – Le sens commun : fondement de la philosophie – La logique et les trois degrés d’abstraction : logique et physique, puis philosophie première – Divisions de la philosophie première – Logique – Rapport entre philosophie première et autres sciences. La philosophie pratique – Tableau des différentes parties de la philosophie – La philosophie des premiers chrétiens à St Augustin – St Augustin et Denys l’Aréopagite – Boèce ; âge préscolastique – XIe et XIIe siècle : diverses positions ; Universaux : philosophie arabe – Les Universités, St Augustin, St Thomas – St Bonaventure, les Averroïstes, Bacon – Scot et le nominalisme avec Guillaume d’Ockam – Maître Eckart : philosophie chrétienne ? – Philosophie chrétienne.",1997 - 1998,"Séminaire Inter. St Pie X, Écône",,31.12.1998
/ru27,PHILOSOPHIE,LES PREUVES DE L’EXISTENCE DE DIEU,M. l’abbe J.M. RULLEAU,,,,,
/ru28,PHILOSOPHIE,MÉTAPHYSIQUE LIVRE VII,M. l’abbé J.-M. RULLEAU,16 cours de 45 minutes environ,,Bellaigue,,
/v08,PHILOSOPHIE,AUTOUR DE SOCRATE,M. le prof. D. VIAIN,Horizons et limites de la sagesse antique.,02.10.1993,Sion,02.10.1993,
/a06,POLITIQUE,QUEL RAPPORT ENTRE MONDIALISME ET ŒCUMÉNISME ?,M. l’abbé J.-P. ANDRÉ,,25.01.1994,Sion,25.01.1994,
/BERN1,POLITIQUE,"L’EMPIRE ÉCOLOGIQUE, OU LA SUBVERSION DE L’ÉCOLOGIE PAR LE MONDIALISME",M. P. BERNARDIN,,18.11.2000,Saillon,18.11.2000,
/BOURB1,POLITIQUE,COMMENT RÉSISTER AU NOUVEL ORDRE MONDIAL ET À L'EUROMONDIALISME,M. J. BOURBON,Conférence du MCCVs.,19.11.2005,Sion,19.11.2005,
/DAM1,POLITIQUE,L’UNION EUROPÉENNE DANS TOUS SES MALHEURS,M. le prof. M. D’AMICO,,27.11.2004,Fully,27.11.2004,
/EMO1,POLITIQUE,LA SITUATION DE NOTRE ARMÉE SUISSE AUJOURD’HUI,M. J. EMONET,Conférence du MCCVs.,22.05.1999,Martigny,22.05.1999,
/fran1,POLITIQUE,LE MONDIALISME : QUELLE MENACE POUR LA FRANCE ?,M. R. FRANCOLIER,,12.05.1997,"Institut Universitaire St-Grégoire le Grand, Lyon",12.05.1997,
/las5,POLITIQUE,LA DÉSINFORMATION MÉDIATIQUE,M. A. de LASSUS,,10.11.1993,"Lauzon, Canada",10.11.1993,
/ma6,POLITIQUE,LA SITUATION ACTUELLE DU MONDE,Rev. Pere J.J. MARZIAC,,29.11.1997,Riddes,29.11.1997,
/MOL1,POLITIQUE,LE GOUVERNEMENT MONDIAL ET L’AVENIR DES NATIONS,M. MOLNAR,,,"Lauzon, Canada",,
/MOUT1,POLITIQUE,LE CONFLIT ISRAËLO - ARABE OU : “LA PRÉPARATION À LA RECONSTRUCTION DU TEMPLE DE JÉRUSALEM”,M. C. MOUTON,,1990 - 1995,,,31.12.1995
/wi11,POLITIQUE,WORLD TRADE CENTER : LA PUNITION DE DIEU,Mgr R. WILLIAMSON,,10.2001,Bordeaux,01.10.2001,31.10.2001
/e08,POUR LES ENFANTS,ANNE DE GUIGNÉ,Mlle M. BASSET,"Née le 25 avril 1911 à Annecy-le-Vieux, morte en odeur de sainteté le 14 janvier 1922 à Cannes - Villa Saint-Benoît.",14.01,,,
/E15,POUR LES ENFANTS,"HERMAN WIJNS, PETIT PRÊTRE",Par une lectrice,"Né le 15 mars 1931, mort en odeur de sainteté le 26 mai 1941. Une vie magnifique à écouter absolument.",,,,
/e27,POUR LES ENFANTS,INSTRUCTION (8),M. l'abbé M.,"5 sermons aux enfants du catéchisme
Avent : L’année liturgique racontée aux enfants.
Tout près de Noël : Le plus beau cadeau.
Carême : la Foi, est-ce important ?
Notre-Dame du Rosaire et Lépante.
La Messe des morts : Le père de St Louis Bertrand.",,Sion,,
/e29,POUR LES ENFANTS,INSTRUCTIONS (10),M. l'abbé M.,"Sermons aux enfants du catéchisme
Le Carême.
Dieu nous a créés parce qu’Il nous aime.
Les dons du Saint-Esprit.
Les saint Rois-Mages.
Le Sacré-Coeur.
Les vacances scolaires.",,Sion,,
/e31,POUR LES ENFANTS,INSTRUCTIONS (12),Abbé M.,"Sermons aux enfants du catéchisme
Le Saint-Esprit.
Enfin la Première Communion !
Le Miracle Eucharistique du moine du désert.
Donner sa vie pour ceux qu’on aime?
La purification de nos péchés (deux miracles eucharistiques).
La confession (chants d’enfants).",,Sion,,
/E13,POUR LES ENFANTS,LA BELLE HISTOIRE DE FATIMA – SON MESSAGE ET SES MYSTÈRES,Par une conteuse,Enfants,,,,
/e32,POUR LES ENFANTS,LA BELLE HISTOIRE DE NOTRE-DAME DE PONTMAIN,Des conteurs,Enfants,,,,
/e33,POUR LES ENFANTS,LE CAPITAINE DARREBERG ET NOTRE-DAME DE LA SALETTE,Des conteurs,Enfants,,,,
/e26,POUR LES ENFANTS,LE SAINT CURE D’ARS,Par un conteur,Enfants,,,,
/E14,POUR LES ENFANTS,LE SECRET DE LA SALETTE,Par une lectrice,"Donné le 19 septembre 1846
Courte biographie de Mélanie Calvat et de Maximin.
Le secret, écrit par Mélanie Calvat à Altamura, le 21.11 1878.
Publié par la Bergère de la Salette avec l’Imprimatur de Monseigneur Zola.",,,,
